,raw,bird,alternate_names,scientific_name
0,"The Iago sparrow (Passer iagoensis), also known as the Cape Verde or rufous-backed sparrow, is a passerine bird of the sparrow family Passeridae",Iago sparrow,"Cape Verde sparrow, rufous-backed sparrow",Passer iagoensis
1,The Ibadan malimbe (Malimbus ibadanensis) is a rare species of bird in the family Ploceidae,Ibadan malimbe,,Malimbus ibadanensis
2,"The Ibera seedeater (Sporophila iberaensis) is a species of bird in the family Thraupidae, formerly included within the family of American sparrows (Emberizidae)",Ibera seedeater,,Sporophila iberaensis
3,"The Iberian chiffchaff (Phylloscopus ibericus) is a species of leaf warbler endemic to Portugal, Spain and North Africa, west of a line stretching roughly from the western Pyrenees via the mountains of central Spain to the Atlantic",Iberian chiffchaff,,Phylloscopus ibericus
4,The Iberian green woodpecker (Picus sharpei) is a medium-sized woodpecker endemic to the Iberian peninsula,Iberian green woodpecker,,Picus sharpei
5,"The Iceland gull (Larus glaucoides) is a medium-sized gull that breeds in the Arctic regions of Canada and Greenland, but not in Iceland (as its name suggests), where it is only seen during winter",Iceland gull,,Larus glaucoides
6,"The icterine greenbul (Phyllastrephus icterinus) is a species of songbird in the bulbul family, Pycnonotidae",Icterine Greenbul,,Phyllastrephus icterinus
7,The icterine warbler (Hippolais icterina) is an Old World warbler in the tree warbler genus Hippolais,Icterine Warbler,,Hippolais icterina
8,Ihering's antwren (Myrmotherula iheringi) is a species of bird in the family Thamnophilidae,Ihering's antwren,,Myrmotherula iheringi
9,The imitator goshawk or imitator sparrowhawk (Accipiter imitator) is a species of bird of prey in the family Accipitridae,imitator goshawk,imitator sparrowhawk,Accipiter imitator
10,"The imperial amazon (Amazona imperialis) or Dominican amazon, also known as the sisserou or sisserou parrot, is a parrot found only on the Caribbean island of Dominica",Imperial Amazon,"Dominican amazon, Sisserou, Sisserou Parrot",Amazona imperialis
11,"The imperial shag or imperial cormorant (Leucocarbo atriceps) is a black and white cormorant native to southern South America, primarily in rocky coastal regions, but locally also at large inland lakes",Imperial Shag,Imperial Cormorant,Leucocarbo atriceps
12,The imperial snipe (Gallinago imperialis) is a small stocky wader which breeds in the Andes,Imperial Snipe,,Gallinago imperialis
13,The imperial woodpecker (Campephilus imperialis) is a woodpecker species endemic to Mexico,imperial woodpecker,,Campephilus imperialis
14,"The Inaccessible Island finch (Nesospiza acunhae), also known as the Inaccessible bunting, is a species of bird in the family Thraupidae (formerly in Emberizidae)",Inaccessible Island finch,Inaccessible bunting,Nesospiza acunhae
15,"The Inaccessible Island rail (Laterallus rogersi) is a small bird of the rail family, Rallidae",Inaccessible Island rail,,Laterallus rogersi
16,The Inambari gnatcatcher (Polioptila attenboroughi) is a species of bird in the family Polioptilidae,Inambari gnatcatcher,,Polioptila attenboroughi
17,The Inambari woodcreeper (Lepidocolaptes fatimalimae) is a species of bird in the subfamily Dendrocolaptinae,Inambari woodcreeper,,Lepidocolaptes fatimalimae
18,The Inca flycatcher (Leptopogon taczanowskii) is a species of bird in the family Tyrannidae,Inca flycatcher,,Leptopogon taczanowskii
19,"The Inca jay or querrequerre (Cyanocorax yncas) is a bird species of the New World jays, which is native to the Andes of South America",Inca jay,querrequerre,Cyanocorax yncas
20,"The  Inca tern (Larosterna inca) is a Near Threatened species of bird in subfamily Sterninae of the family Laridae, the gulls, terns, and skimmers",Inca Tern,,Larosterna inca
21,The Indian blackbird (Turdus simillimus) is a member of the thrush family Turdidae,Indian blackbird,,Turdus simillimus
22,The Indian bush lark (Mirafra erythroptera) is a species of lark in the family Alaudidae found in South Asia,Indian bush lark,,Mirafra erythroptera
23,The Indian cormorant or Indian shag (Phalacrocorax fuscicollis) is a member of the cormorant family,Indian cormorant,Indian shag,Phalacrocorax fuscicollis
24,"The  Indian cuckoo (Cuculus micropterus) is a member of the cuckoo order of birds, the Cuculiformes, that is found in the Indian subcontinent and Southeast Asia",Indian cuckoo,,Cuculus micropterus
25,The Indian golden oriole (Oriolus kundoo) is a species of oriole found in the Indian subcontinent and Central Asia,Indian golden oriole,,Oriolus kundoo
26,The Indian grassbird (Graminicola bengalensis) is a passerine bird in the family Pellorneidae,Indian grassbird,,Graminicola bengalensis
27,The Indian nightjar (Caprimulgus asiaticus) is a small nightjar which is a resident breeder in open lands across South Asia and Southeast Asia,Indian nightjar,,Caprimulgus asiaticus
28,The Indian nuthatch (Sitta castanea) is a species of bird in the family Sittidae,Indian nuthatch,,Sitta castanea
29,"The Indian peafowl (Pavo cristatus), also known as the common peafowl, and blue peafowl, is a peafowl species native to the Indian subcontinent",Indian peafowl,"common peafowl, blue peafowl",Pavo cristatus
30,The Indian robin (Copsychus fulicatus)[note 1] is a species of passarine bird in the family Muscicapidae,Indian robin,,Copsychus fulicatus
31,The Indian scops owl (Otus bakkamoena) is a species of owl native to South Asia,Indian scops owl,,Otus bakkamoena
32,The Indian silverbill or white-throated munia (Euodice malabarica) is a small passerine bird found in the Indian Subcontinent and adjoining regions that was formerly considered to include the closely related African silverbill (Euodice cantans),Indian silverbill,white-throated munia,Euodice malabarica
33,"The Indian spotted creeper (Salpornis spilonota) is a small passerine bird, which is a member of the subfamily Salpornithinae which is placed along with the treecreepers in the family Certhiidae",Indian spotted creeper,,Salpornis spilonota
34,The Indian stone-curlew or Indian thick-knee (Burhinus indicus) is a species of bird in the family Burhinidae,Indian stone-curlew,Indian thick-knee,Burhinus indicus
35,The Indian swiftlet or Indian edible-nest swiftlet  (Aerodramus unicolor) is a small swift,Indian swiftlet,Indian edible-nest swiftlet,Aerodramus unicolor
36,"The Indian vulture (Gyps indicus) is an Old World vulture native to India, Pakistan and Nepal",Indian vulture,,Gyps indicus
37,"The indigo bunting (Passerina cyanea) is a small seed-eating bird in the cardinal family, Cardinalidae",indigo bunting,,Passerina cyanea
38,The Indigo-banded kingfisher (Ceyx cyanopectus) is a species of bird in the family Alcedinidae,Indigo-banded kingfisher,,Ceyx cyanopectus
39,"The Indochinese barbet (Psilopogon annamensis), also called Annam barbet, is a bird belonging to the family Megalaimidae",Indochinese barbet,Annam barbet,Psilopogon annamensis
40,The Indochinese blue flycatcher (Cyornis sumatrensis) is a species of bird in the family Muscicapidae,Indochinese blue flycatcher,,Cyornis sumatrensis
41,The Indochinese bush lark (Mirafra erythrocephala) or Indochinese lark is a species of lark in the family Alaudidae found in southeast Asia,Indochinese bush lark,Indochinese lark,Mirafra erythrocephala
42,The Indochinese cuckooshrike (Lalage polioptera) is a species of bird in the family Campephagidae,Indochinese cuckooshrike,,Lalage polioptera
43,"The Indochinese green magpie (Cissa hypoleuca) or yellow-breasted magpie, is a passerine bird of the crow family, Corvidae",Indochinese green magpie,yellow-breasted magpie,Cissa hypoleuca
44,"The Indochinese roller (Coracias affinis) or Burmese roller, is a member of the roller bird family",Indochinese roller,Burmese roller,Coracias affinis
45,The Indochinese yuhina or chestnut-collared yuhina (Staphida torqueola) is a bird in the family Zosteropidae,Indochinese yuhina,Chestnut-collared yuhina,Staphida torqueola
46,The inland thornbill (Acanthiza apicalis) was originally described by English ornithologist John Gould in The Birds of Australia,inland thornbill,,Acanthiza apicalis
47,"The intermediate egret, median egret, smaller egret, or yellow-billed egret (Ardea intermedia) is a medium-sized heron",intermediate egret,"median egret, smaller egret, yellow-billed egret",Ardea intermedia
48,"The Iphis monarch (Pomarea iphis), or Ua Huka flycatcher, is a species of bird in the family Monarchidae",Iphis monarch,Ua Huka flycatcher,Pomarea iphis
49,The Iquitos gnatcatcher (Polioptila clementsi) is a bird in the family Polioptilidae,Iquitos gnatcatcher,,Polioptila clementsi
50,"The Iraq babbler (Argya altirostris) is a species of bird in the family Leiothrichidae, native to reed beds of the Tigris-Euphrates Valley",Iraq babbler,,Argya altirostris
51,The Iringa akalat (Sheppardia lowei) is a species of bird in the family Muscicapidae,Iringa akalat,,Sheppardia lowei
52,The Iriomote tit (Sittiparus olivaceus) is a small passerine bird in the tit family Paridae,Iriomote tit,,Sittiparus olivaceus
53,"The iris lorikeet (Saudareos iris) is a small, up to 20 cm long, green lorikeet bird",lorikeet,Saudareos iris,Iris lorikeet
54,The Isabela oriole (Oriolus isabellae) is a species of the oriole family endemic to Luzon in the Philippines,Isabela oriole,,Oriolus isabellae
55,The isabelline shrike or Daurian shrike (Lanius isabellinus) is a member of the shrike family (Laniidae),Isabelline Shrike,Daurian Shrike,Lanius isabellinus
56,"The isabelline wheatear (Oenanthe isabellina) is a small passerine bird that was formerly classed as a member of the thrush family Turdidae, but is now more generally considered to be an Old World flycatcher in the family Muscicapidae",Isabelline Wheatear,,Oenanthe Isabellina
57,"The island bronze-naped pigeon (Columba malherbii), also known as the São Tomé bronze-naped pigeon, is a species of bird in the family Columbidae",island bronze-naped pigeon,São Tomé bronze-naped pigeon,Columba malherbii
58,The island imperial pigeon (Ducula pistrinaria) is a species of bird in the family Columbidae,Island Imperial Pigeon,,Ducula pistrinaria
59,The island leaf warbler (Phylloscopus poliocephalus) is a species of Old World warbler in the family Phylloscopidae,Island Leaf Warbler,,Phylloscopus poliocephalus
60,"The island scrub jay (Aphelocoma insularis), also known as the island jay or Santa Cruz jay, is a bird in the genus, Aphelocoma, which is endemic to Santa Cruz Island off the coast of Southern California",island scrub jay,"island jay, Santa Cruz jay",Aphelocoma insularis
61,The island whistler (Pachycephala phaionota) is a species of bird in the family Pachycephalidae endemic to the Moluccas (Indonesia),island whistler,,Pachycephala phaionota
62,The islet kingfisher (Todiramphus colonus) is a species of bird in the family Alcedinidae,islet kingfisher,,Todiramphus colonus
63,The isthmian wren (Cantorchilus elutus) is a species of bird in the family Troglodytidae,Isthmian Wren,,Cantorchilus elutus
64,"The Italian sparrow (Passer italiae), also known as the cisalpine sparrow, is a passerine bird of the sparrow family Passeridae, found in Italy and other parts of the Mediterranean region",Italian sparrow,Cisalpine sparrow,Passer italiae
65,"The Itatiaia spinetail (Asthenes moreirae), also known as the Itatiaia thistletail, is a species of bird in the family Furnariidae",Itatiaia spinetail,Itatiaia thistletail,Asthenes moreirae
66,The Itombwe flycatcher (Muscicapa itombwensis) is a bird species in the Old World flycatcher family (Muscicapidae),Itombwe flycatcher,,Muscicapa itombwensis
67,"The Ituri batis or Chapin's batis (Batis ituriensis) is a species of bird in the wattle-eye family, Platysteiridae which is found in the humid forests of eastern central Africa",Ituri batis,Chapins batis,Batis ituriensis
68,"The ivory gull (Pagophila eburnea) is a small gull, the only species in the genus Pagophila",ivory gull,,Pagophila eburnea
69,The ivory-backed woodswallow (Artamus monachus) is a species of bird in the family Artamidae,ivory-backed woodswallow,,Artamus monachus
70,The ivory-billed coucal or greater black coucal (Centropus menbeki) is a species of cuckoo in the family Cuculidae,ivory-billed coucal,greater black coucal,Centropus menbeki
71,"The ivory-billed woodcreeper (Xiphorhynchus flavigaster) is a species of bird of the order of Passeriformes, which are perching birds",ivory-billed woodcreeper,,Xiphorhynchus flavigaster
72,The ivory-breasted pitta (Pitta maxima) is a species of bird in the family Pittidae,Pitta maxima,ivory-breasted pitta,Pitta maxima
73,The Izu thrush or Izu Islands thrush (Turdus celaenops) is a bird of the thrush family native to Japan,Izu thrush,Izu Islands thrush,Turdus celaenops
74,The gabar goshawk (Micronisus gabar) is a small species of African and Arabian bird of prey in the family Accipitridae,Gabar Goshawk,,Micronisus gabar
75,The Gabela akalat (Sheppardia gabela) is a species of bird in the family Muscicapidae,Gabela akalat,,Sheppardia gabela
76,"The Gabela helmetshrike (Prionops gabela) is a species of bird in the Vanga family Vangidae, formerly usually included in the Malaconotidae",Gabela helmetshrike,,Prionops gabela
77,The Gabon coucal (Centropus anselli) is a species of cuckoo in the family Cuculidae,Gabon coucal,,Centropus anselli
78,The Gabon woodpecker (Dendropicos gabonensis) is a species of small woodpecker in the family Picidae which occurs in western central Africa,Gabon woodpecker,,Dendropicos gabonensis
79,The gadwall (Mareca strepera) is a common and widespread dabbling duck[2] in the family Anatidae,gadwall,,Mareca strepera
80,"The galah (/ɡəˈlɑː/; Eolophus roseicapilla), also known as the pink and grey cockatoo or rose-breasted cockatoo,[2] is the only species within genus Eolophus of the cockatoo family",galah,"pink and grey cockatoo, rose-breasted cockatoo",Eolophus roseicapilla
81,"The Galapagos crake (Laterallus spilonota), also called the Galapagos rail and Darwin's rail, is a Vulnerable species of rail in subfamily Rallinae of family Rallidae, the rails, gallinules, and coots",Galapagos crake,"Galapagos rail, Darwins rail",Laterallus spilonota
82,The Galápagos dove (Zenaida galapagoensis) is a species of bird in the family Columbidae,Galápagos dove,,Zenaida galapagoensis
83,The Galápagos flycatcher (Myiarchus magnirostris) also known as the large-billed flycatcher is a species of bird in the family Tyrannidae,Galápagos flycatcher,large-billed flycatcher,Myiarchus magnirostris
84,The Galápagos hawk (Buteo galapagoensis) is a large hawk endemic to most of the Galápagos Islands,Galápagos hawk,,Buteo galapagoensis
85,"The Galápagos martin (Progne modesta) is a species of bird in the family Hirundinidae, endemic to the Galápagos Islands",Galápagos martin,,Progne modesta
86,The Galápagos mockingbird (Mimus parvulus) is a species of bird in the family Mimidae,Galápagos mockingbird,,Mimus parvulus
87,"The Galápagos penguin (Spheniscus mendiculus) is a penguin endemic to the Galápagos Islands, Ecuador",Galápagos penguin,,Spheniscus mendiculus
88,The Galápagos petrel (Pterodroma phaeopygia) is one of the six endemic seabirds of the Galápagos,Galápagos petrel,,Pterodroma phaeopygia
89,The Gambaga flycatcher (Muscicapa gambagae) is a species of bird in the family Muscicapidae,Gambaga flycatcher,,Muscicapa gambagae
90,Gambel's quail (Callipepla gambelii) is a small ground-dwelling bird in the New World quail family,Gambel's quail,,Callipepla gambelii
91,"The gang-gang cockatoo (Callocephalon fimbriatum) is a parrot found in the cooler and wetter forests and woodlands of Australia, particularly alpine bushland",gang-gang cockatoo,,Callocephalon fimbriatum
92,The Gansu leaf warbler (Phylloscopus kansuensis) is a small passerine bird known only from China,Gansu leaf warbler,,Phylloscopus kansuensis
93,"The garden emerald (Chlorostilbon assimilis) is a small hummingbird in the ""emeralds"", tribe Trochilini of subfamily Trochilinae",Garden Emerald,,Chlorostilbon assimilis
94,The garden warbler (Sylvia borin) is a common and widespread small bird that breeds in most of Europe and in the Palearctic to western Siberia,Garden Warbler,,Sylvia borin
95,The garganey (Spatula querquedula) is a small dabbling duck,garganey,,Spatula querquedula
96,The garnet robin (Eugerygone rubra) is a species of bird in the family Petroicidae,garnet robin,,Eugerygone rubra
97,The garnet-throated hummingbird (Lamprolaima rhami) is a species of hummingbird in tribe Lampornithini of subfamily Trochilinae,garnet-throated hummingbird,,Lamprolaima rhami
98,"Garrett's reed warbler (Acrocephalus musae), sometimes called Society Islands reed warbler or Forster's reed-warbler was a songbird in the genus Acrocephalus",Garrett's reed warbler,"Society Islands reed warbler, Forsters reed-warbler",Acrocephalus musae
99,The Geelvink pygmy parrot  (Micropsitta geelvinkiana) is a species of parrot in the family Psittacidae endemic to Biak and Numfoor islands in Western New Guinea,Geelvink pygmy parrot,,Micropsitta geelvinkiana
100,The Genovesa cactus finch (Geospiza propinqua) is a species of bird in the tanager family Thraupidae,Genovesa cactus finch,,Geospiza propinqua
101,"The gentoo penguin (/ˈdʒɛntuː/ JEN-too) (Pygoscelis papua) is a penguin species (or possibly a species complex) in the genus Pygoscelis, most closely related to the Adélie penguin (P",Gentoo Penguin,,Pygoscelis papua
102,Germain's peacock-pheasant (Polyplectron germaini) is a pheasant that is endemic to Indochina,Germain's peacock-pheasant,,Polyplectron germaini
103,The giant antpitta (Grallaria gigantea) is a perching bird species in the antpitta family (Grallariidae),Giant Antpitta,,Grallaria gigantea
104,"The giant antshrike (Batara cinerea) is a species of bird in the family Thamnophilidae, belonging to the monotypic genus Batara",Giant Antshrike,,Batara cinerea
105,"The giant coot (Fulica gigantea) is a species of bird in subfamily Rallinae of family Rallidae, the rails, gallinules, and coots",Giant Coot,,Fulica gigantea
106,The giant coua (Coua gigas) is a bird species from the coua genus in the cuckoo family that is endemic to the dry forests of western and southern Madagascar,Giant Coua,,Coua gigas
107,The giant honeyeater or duetting giant honeyeater (Gymnomyza brunneirostris) is a species of bird in the family Meliphagidae,Giant Honeyeater,Duetting Giant Honeyeater,Gymnomyza brunneirostris
108,"The giant hummingbird (Patagona gigas) is the only member of the genus Patagona and the largest member of the hummingbird family, weighing 18–24 g (0",Giant Hummingbird,,Patagona gigas
109,The giant kingbird (Tyrannus cubensis) is a species of bird in the tyrant flycatcher family Tyrannidae endemic to Cuba,Giant Kingbird,,Tyrannus cubensis
110,"The giant kingfisher (Megaceryle maxima) is the largest kingfisher in Africa, where it is a resident breeding bird over most of the continent south of the Sahara Desert, other than the arid southwest",Giant Kingfisher,,Megaceryle maxima
111,The giant nuthatch (Sitta magna) is a species of bird in the family Sittidae,giant nuthatch,,Sitta magna
112,The giant pitta (Hydrornis caeruleus) is a species of bird in the family Pittidae,Giant Pitta,,Hydrornis caeruleus
113,"The giant scops owl (Otus gurneyi), lesser eagle-owl or the Mindanao eagle-owl, is a species of owl in the family Strigidae",Giant Scops Owl,"Lesser Eagle-Owl, Mindanao Eagle-Owl",Otus gurneyi
114,The giant snipe (Gallinago undulata) is a stocky wader,Giant Snipe,,Gallinago undulata
115,The giant sunbird (Dreptes thomensis) is a species of bird in the family Nectariniidae,Giant Sunbird,,Dreptes thomensis
116,The giant weaver (Ploceus grandis) is a species of bird in the family Ploceidae,giant weaver,,Ploceus grandis
117,"The giant white-eye, or Palau greater white-eye (Megazosterops palauensis) is a species of bird in the family Zosteropidae",giant white-eye,Palau greater white-eye,Megazosterops palauensis
118,"The giant wood rail (Aramides ypecaha) is a species of bird in the subfamily Rallinae of the rail, crake, and coot family Rallidae",Giant wood rail,,Aramides ypecaha
119,The giant wren (Campylorhynchus chiapensis) is a species of bird in the family Troglodytidae,giant wren,,Campylorhynchus chiapensis
120,The gibberbird (Ashbyia lovensis) is a species of chat within the Meliphagidae family of passerine birds,gibberbird,,Ashbyia lovensis
121,The Gila woodpecker (Melanerpes uropygialis) is a medium-sized woodpecker of the desert regions of the southwestern United States and western Mexico,Gila woodpecker,,Melanerpes uropygialis
122,"Gilbert's honeyeater (Melithreptus chloropsis), also known as the Swan River honeyeater or western white-naped honeyeater, is a passerine bird of the honeyeater family Meliphagidae native to southwestern Australia",Gilbert's honeyeater,"Swan River honeyeater, western white-naped honeyeater",Melithreptus chloropsis
123,"The Gilbert's whistler (Pachycephala inornata) is a monotypic species of bird endemic to Australia, scattered in semi-arid zones of southern Australia",Gilbert's whistler,,Pachycephala inornata
124,"The gilded barbet (Capito auratus) is a species of bird in the family Capitonidae, the New World barbets, and are close relatives of the toucans",gilded barbet,,Capito auratus
125,"The gilded flicker (Colaptes chrysoides) is a large-sized woodpecker (mean length of 29 cm (11 in)) of the Sonoran, Yuma, and eastern Colorado Desert regions of the southwestern United States and northwestern Mexico, including all of Baja California, except the extreme northwestern region",gilded flicker,,Colaptes chrysoides
126,"The gilded sapphire (Hylocharis chrysura), also known as the gilded hummingbird, is a species of hummingbird in the ""emeralds"", tribe Trochilini of subfamily Trochilinae",Gilded sapphire,Gilded hummingbird,Hylocharis chrysura
127,The Gizo white-eye or yellow-billed white-eye (Zosterops luteirostris) is a species of bird in the family Zosteropidae,Gizo white-eye,yellow-billed white-eye,Zosterops luteirostris
128,"The glaucous gull (Larus hyperboreus) is a large gull, the second-largest gull in the world",glaucous gull,,Larus hyperboreus
129,"The glaucous macaw (Anodorhynchus glaucus) is a critically endangered or possibly extinct species of large, blue and grey South American parrot, a member of a large group of neotropical parrots known as macaws",glaucous macaw,,Anodorhynchus glaucus
130,The glaucous tanager (Thraupis glaucocolpa) is a species of bird in the family Thraupidae,glaucous tanager,,Thraupis glaucocolpa
131,"The glaucous-winged gull (Larus glaucescens) is a large, white-headed gull",glaucous-winged gull,,Larus glaucescens
132,The glistening-green tanager (Chlorochrysa phoenicotis) is a species of bird in the family Thraupidae,Glistening-green tanager,,Chlorochrysa phoenicotis
133,"The glittering-throated emerald (Chionomesa fimbriata) is a species of hummingbird in the ""emeralds"", tribe Trochilini of subfamily Trochilinae",glittering-throated emerald,,Chionomesa fimbriata
134,"The glossy antshrike (Sakesphorus luctuosus) is a species of bird in the family Thamnophilidae, the antbirds",glossy antshrike,,Sakesphorus luctuosus
135,The glossy flowerpiercer (Diglossa lafresnayii) is a species of bird in the family Thraupidae,glossy flowerpiercer,,Diglossa lafresnayii
136,The glossy ibis (Plegadis falcinellus) is a water bird in the order Pelecaniformes and the ibis and spoonbill family Threskiornithidae,glossy ibis,,Plegadis falcinellus
137,The glossy-mantled manucode (Manucodia ater) is a species of bird-of-paradise,glossy-mantled manucode,,Plegadis falcinellus
138,"The glowing puffleg (Eriocnemis vestita) is a species of hummingbird in the ""brilliants"", tribe Heliantheini in subfamily Lesbiinae",glowing puffleg,,Eriocnemis vestita
139,"The glow-throated hummingbird (Selasphorus ardens) is an Endangered species of hummingbird in tribe Mellisugini of subfamily Trochilinae, the ""bee hummingbirds""",glow-throated hummingbird,,Selasphorus ardens
140,Godlewski's bunting (Emberiza godlewskii) is a species of bird in the family Emberizidae,Godlewski's bunting,,Emberiza godlewskii
141,The Gola malimbe or Ballman's malimbe (Malimbus ballmanni) is a species of bird in the family Ploceidae,Gola malimbe,Ballmans malimbe,Malimbus ballmanni
142,The goldcrest (Regulus regulus) is a very small passerine bird in the kinglet family,goldcrest,,Regulus regulus
143,The golden babbler (Cyanoderma chrysaeum) is a babbler species in the family Timaliidae,golden babbler,,Cyanoderma chrysaeum
144,"The golden bowerbird (Prionodura newtoniana) is a species of bird in the family Ptilonorhynchidae, the bowerbirds",golden bowerbird,,Prionodura newtoniana
145,"The golden bush robin (Tarsiger chrysaeus) or golden bush-robin was first discovered in 1845 by Brian Houghton Hodgson, a British naturalist",Golden Bush Robin,Golden Bush-Robin,Tarsiger chrysaeus
146,The golden cuckooshrike (Campochaera sloetii) is a species of bird in the family Campephagidae,golden cuckooshrike,,Campochaera sloetii
147,"The golden fruit dove (Ptilinopus luteovirens), also known as the lemon dove or yellow dove, is a small, approximately 20 cm (8 in) long, short-tailed fruit-dove in the family Columbidae",golden fruit dove,"lemon dove, yellow dove",Ptilinopus luteovirens
148,"The golden grosbeak (Pheucticus chrysogaster), also known as golden-bellied grosbeak or southern yellow grosbeak, is a species of grosbeak in the family Cardinalidae",Golden Grosbeak,"Golden-bellied Grosbeak, Southern Yellow Grosbeak",Pheucticus chrysogaster
149,"The golden masked owl (Tyto aurantia) is a barn owl endemic to the island of New Britain, Papua New Guinea",Barn Owl,,Tyto aurantia
150,The golden myna (Mino anais) is a species of starling in the family Sturnidae,Golden Myna,,Mino anais
