,raw,bird,alternate_names,scientific_name
445,The grey longbill (Macrosphenus concolor) is a species of Old World warbler in the family Macrosphenidae,Grey Longbill,,Macrosphenus concolor
446,The grey monjita (Nengetus cinereus) is a species of bird in the family Tyrannidae that is the only member of the genus Nengetus,grey monjita,,Nengetus cinereus
447,The grey nightjar or gray nightjar (Caprimulgus jotaka) is a species of nightjar found in East Asia,nightjar,"grey nightjar, gray nightjar",Caprimulgus jotaka
448,"The grey penduline tit (Anthoscopus caroli), also known as the African penduline-tit, is a species of bird in the family Remizidae",grey penduline tit,African penduline-tit,Anthoscopus caroli
449,"The grey petrel (Procellaria cinerea), also called the brown petrel, pediunker or grey shearwater is a species of seabird in the Procellariidae, or petrel family",grey petrel,"brown petrel, pediunker, grey shearwater",Procellaria cinerea
450,"The grey pileated finch (Coryphospingus pileatus), also known as the pileated finch, is a species of bird in the family Thraupidae, where it has recently been moved to from the Emberizidae",pileated finch,grey pileated finch,Coryphospingus pileatus
451,"The grey pratincole (Glareola cinerea) is a species of bird, in the family Glareolidae",Grey Pratincole,,Glareola cinerea
452,The grey seedeater (Sporophila intermedia) is a species of bird in the family Thraupidae,grey seedeater,,Sporophila intermedia
453,The grey sibia (Heterophasia gracilis) is a species of bird in the family Leiothrichidae,grey sibia,,Heterophasia gracilis
454,"The grey silky-flycatcher or grey silky flycatcher (Ptiliogonys cinereus), is a species of bird in the family Ptiliogonatidae",Grey Silky-Flycatcher,,Ptiliogonys cinereus
455,The grey tit-flycatcher (Myioparus plumbeus) is a species of bird in the family Muscicapidae,grey tit-flycatcher,,Myioparus plumbeus
456,"The grey treepie (Dendrocitta formosae), also known as the Himalayan treepie, is an Asian treepie, a medium-sized and long-tailed member of the crow family",Grey Treepie,Himalayan Treepie,Dendrocitta formosae
457,"The grey warbler-finch (Certhidea fusca) is a species of bird, one of Darwin's finches in the tanager family Thraupidae",Grey Warbler-Finch,,Certhidea fusca
458,The grey waxbill or black-tailed waxbill (Glaucestrilda perreini) is a common species of estrildid finch found in wetter land of Southern Africa,Grey Waxbill,Black-tailed Waxbill,Glaucestrilda perreini
459,The grey wren-warbler (Calamonastes simplex) is a species of bird in the family Cisticolidae,grey wren-warbler,,Calamonastes simplex
460,The grey-and-buff woodpecker (Hemicircus concretus) is a species of bird in the family Picidae,woodpecker,,Hemicircus concretus
461,The grey-and-gold tanager (Poecilostreptus palmeri) is a species of bird in the family Thraupidae,grey-and-gold tanager,,Poecilostreptus palmeri
462,The grey-backed camaroptera (Camaroptera brevicaudata) is a small bird in the family Cisticolidae,grey-backed camaroptera,,Camaroptera brevicaudata
463,The grey-backed fiscal (Lanius excubitoroides) is a species of bird in the family Laniidae,grey-backed fiscal,,Lanius excubitoroides
464,The grey-backed shrike (Lanius tephronotus) is a bird in the family Laniidae inhabiting South-east Asia,grey-backed shrike,,Lanius tephronotus
465,The grey-backed storm petrel (Garrodia nereis) is a species of seabird in the austral storm petrel family Oceanitidae,grey-backed storm petrel,,Garrodia nereis
466,The grey-backed tachuri (Polystictus superciliaris) is a species of bird in the family Tyrannidae,grey-backed tachuri,,Polystictus superciliaris
467,"The gray-backed tailorbird (Orthotomus derbianus) is a species of bird formerly placed in the ""Old World warbler"" assemblage, it but now placed in the family Cisticolidae",gray-backed tailorbird,Orthotomus derbianus,Old World warbler
468,The grey-backed thrush (Turdus hortulorum) is a species of bird in the family Turdidae,grey-backed thrush,,Turdus hortulorum
469,"The grey-banded mannikin (Lonchura vana), or grey-banded munia, is a species of estrildid finch known to be found in Anggi Gigi, Tamrau Mountains, and Arfak Mountains in the Vogelkop Peninsula in north-western Papua, Indonesia",Grey-banded Mannikin,Grey-banded Munia,Lonchura vana
470,The grey-bellied bulbul (Ixodia cyaniventris) is a species of songbird in the bulbul family,grey-bellied bulbul,,Ixodia cyaniventris
471,The grey-bellied comet (Taphrolesbia griseiventris) is a species of hummingbird in the family Trochilidae,hummingbird,grey-bellied comet,Taphrolesbia griseiventris
472,The grey-bellied cuckoo or the Indian plaintive cuckoo (Cacomantis passerinus) is a cuckoo with widespread occurrence throughout Asia,grey-bellied cuckoo,Indian plaintive cuckoo,Cacomantis passerinus
473,The grey-bellied flowerpiercer (Diglossa carbonaria) is a species of bird in the family Thraupidae,Grey-bellied Flowerpiercer,,Diglossa carbonaria
474,The grey-bellied hawk or grey-bellied goshawk (Accipiter poliogaster) is a fairly large and rare species of forest-dwelling South American bird of prey in the family Accipitridae,grey-bellied hawk,grey-bellied goshawk,Accipiter poliogaster
475,The grey-bellied shrike-tyrant (Agriornis micropterus) is a species of bird in the family Tyrannidae,Grey-bellied Shrike-Tyrant,,Agriornis micropterus
476,The grey-bellied spinetail (Synallaxis cinerascens) is a species of bird in the family Furnariidae,grey-bellied spinetail,,Synallaxis cinerascens
477,The grey-bellied tesia (Tesia cyaniventer) is a species of warbler in the family Cettiidae,Tesia cyaniventer,Grey-bellied Tesia,Tesia cyaniventer
478,The grey-breasted babbler (Malacopteron albogulare) is a species of bird in the family Pellorneidae,grey-breasted babbler,,Malacopteron albogulare
479,"The grey-breasted crake (Laterallus exilis) is a species of bird in subfamily Rallinae of family Rallidae, the rails, gallinules, and coots",grey-breasted crake,,Laterallus exilis
480,The grey-breasted flycatcher (Lathrotriccus griseipectus) is a species of bird in the family Tyrannidae,grey-breasted flycatcher,,Lathrotriccus griseipectus
481,The grey-breasted martin (Progne chalybea) is a large swallow from Central and South America,grey-breasted martin,,Progne chalybea
482,The grey-breasted mountain toucan (Andigena hypoglauca) is a Near Threatened species of bird in the toucan family Ramphastidae,Grey-breasted mountain toucan,,Andigena hypoglauca
483,"The grey-breasted parakeet (Pyrrhura griseipectus) is an Endangered species of bird in subfamily Arinae of the family Psittacidae, the African and New World parrots",Grey-breasted parakeet,,Pyrrhura griseipectus
484,"The grey-breasted partridge (Arborophila orientalis), also known as the white-faced hill partridge, or Horsfield's hill partridge, is a bird species in the family Phasianidae",grey-breasted partridge,"white-faced hill partridge, Horsfields hill partridge",Arborophila orientalis
485,The grey-breasted prinia or Franklin's prinia (Prinia hodgsonii) is a wren-warbler belonging to the family of small passerine birds found mainly in warmer southern regions of the Old World,Grey-breasted prinia,Franklins prinia,Prinia hodgsonii
486,"The grey-breasted sabrewing (Campylopterus largipennis) is a species of hummingbird in the ""emeralds"", tribe Trochilini of subfamily Trochilinae",grey-breasted sabrewing,,Campylopterus largipennis
487,The grey-breasted seedsnipe (Thinocorus orbignyianus) is a species of bird in the family Thinocoridae,Grey-breasted Seedsnipe,,Thinocorus orbignyianus
488,The grey-breasted spiderhunter (Arachnothera modesta) is a species of bird in the family Nectariniidae,Grey-breasted Spiderhunter,,Arachnothera modesta
489,The grey-breasted wood wren (Henicorhina leucophrys) is a species of bird in the family Troglodytidae,grey-breasted wood wren,,Henicorhina leucophrys
490,The grey-breasted woodpecker (Melanerpes hypopolius) is a species of bird in the family Picidae,grey-breasted woodpecker,,Melanerpes hypopolius
491,The grey-brown white-eye or Pohnpei white-eye (Zosterops ponapensis) is a species of bird in the family Zosteropidae,Pohnpei white-eye,grey-brown white-eye,Zosterops ponapensis
492,The grey-capped cicadabird or Melanesian cicadabird (Edolisoma remotum) is a species of bird in the family Campephagidae,Grey-capped cicadabird,Melanesian cicadabird,Edolisoma remotum
493,"The grey-capped cuckoo (Coccyzus lansbergi) is a species of bird in the tribe Phaenicophaeini, subfamily Cuculinae of the cuckoo family Cuculidae",Grey-capped cuckoo,,Coccyzus lansbergi
494,"The  grey-capped flycatcher (Myiozetetes granadensis) is a passerine bird, a member of the large tyrant flycatcher family",grey-capped flycatcher,,Myiozetetes granadensis
495,The grey-capped greenfinch or Oriental greenfinch (Chloris sinica) is a small passerine bird in the finch family Fringillidae that breeds in broadleaf and conifer woodlands of the East Palearctic,Oriental greenfinch,grey-capped greenfinch,Chloris sinica
496,The grey-capped hemispingus (Kleinothraupis reyi) is a species of bird in the family Thraupidae that is endemic to Venezuela,grey-capped hemispingus,,Kleinothraupis reyi
497,Picoides canicapillusDryobates semicoronatusDendrocopus canicapillus[1],Picoides canicapillus,"Dryobates semicoronatus, Dendrocopus canicapillus",Picoides canicapillus
498,"The grey-capped social weaver (Pseudonigrita arnaudi) is a sparrow-like liver-colored bird, with a pale grey crown, a dark grey bill, a whitish eye-ring, horn-colored legs, with some black in the wing and a light terminal band in the tail, that builds roofed nests made of straws, breeds in colonies in thorny Acacia trees, and feeds in groups gathering grass seeds and insects",Grey-capped social weaver,,Pseudonigrita arnaudi
499,The grey-capped tyrannulet (Phyllomyias griseocapilla) is a species of bird in the family Tyrannidae,grey-capped tyrannulet,,Phyllomyias griseocapilla
500,The grey-capped warbler (Eminia lepida) is a species of bird in the family Cisticolidae,grey-capped warbler,,Eminia lepida
501,"The grey-cheeked bulbul (Alophoixus tephrogenys) is a species of songbird in the bulbul family, Pycnonotidae",grey-cheeked bulbul,,Alophoixus tephrogenys
502,The grey-cheeked fulvetta or Morrison's fulvetta (Alcippe morrisonia) is a bird in the family Alcippeidae,grey-cheeked fulvetta,Morrisons fulvetta,Alcippe morrisonia
503,The grey-cheeked green pigeon (Treron griseicauda) is a species of bird in the family Columbidae,Treron griseicauda,grey-cheeked green pigeon,Treron griseicauda
504,"The grey-cheeked nunlet (Nonnula frontalis) is a species of near-passerine bird in the family Bucconidae, the puffbirds, nunlets, and nunbirds",Grey-cheeked Nunlet,"Puffbirds, Nunlets, Nunbirds",Nonnula frontalis
505,"The grey-cheeked parakeet (Brotogeris pyrrhoptera), less commonly known as fire-winged parakeet, is a Vulnerable species of bird in subfamily Arinae of the family Psittacidae, the African and New World parrots",Grey-cheeked Parakeet,Fire-winged Parakeet,Brotogeris pyrrhoptera
506,The grey-cheeked tit-babbler (Mixornis flavicollis) is a species of bird in the family Timaliidae,Grey-cheeked tit-babbler,,Mixornis flavicollis
507,The grey-chested greenlet (Hylophilus semicinereus) is a species of bird in the family Vireonidae,grey-chested greenlet,,Hylophilus semicinereus
508,The grey-chinned hermit (Phaethornis griseogularis) is a species of hummingbird in the family Trochilidae,Grey-chinned Hermit,,Phaethornis griseogularis
509,The grey-chinned minivet (Pericrocotus solaris) is a species of bird in the family Campephagidae,grey-chinned minivet,,Pericrocotus solaris
510,The grey-chinned sunbird (Anthreptes tephrolaemus) is a species of bird in the family Nectariniidae,Grey-chinned sunbird,,Anthreptes tephrolaemus
511,The grey-collared becard (Pachyramphus major) is a species of bird in the family Tityridae,Grey-collared Becard,,Pachyramphus major
512,"The grey-collared oriole (Oriolus forsteni), or Seram oriole, is a species of bird in the family Oriolidae",grey-collared oriole,Seram oriole,Oriolus forsteni
513,The grey-crested finch (Lophospingus griseocristatus) is a species of bird in the tanager family Thraupidae,grey-crested finch,,Lophospingus griseocristatus
514,"The gray-crested helmetshrike (Prionops poliolophus) is a species of bird in the Vanga family Vangidae, formerly usually included in the Malaconotidae",gray-crested helmetshrike,,Prionops poliolophus
515,The grey-crowned babbler (Pomatostomus temporalis) is a species of bird in the family Pomatostomidae,grey-crowned babbler,,Pomatostomus temporalis
516,The grey-crowned crocias (Laniellus langbianis) is a passerine bird in the family Leiothrichidae,grey-crowned crocias,,Laniellus langbianis
517,The grey-crowned flatbill or grey-crowned flycatcher (Tolmomyias poliocephalus) is a species of bird in the family Tyrannidae,grey-crowned flatbill,grey-crowned flycatcher,Tolmomyias poliocephalus
518,"The grey-crowned mannikin (Lonchura nevermanni), or grey-crowned munia,  is a species of estrildid finch of southern New Guinea",Grey-crowned mannikin,Grey-crowned munia,Lonchura nevermanni
519,The grey-crowned prinia (Prinia cinereocapilla) is a species of bird in the family Cisticolidae,grey-crowned prinia,,Prinia cinereocapilla
520,"The grey-crowned tanager or grey-crowned palm-tanager (Phaenicophilus poliocephalus) is a Near Threatened species of bird in the family Phaenicophilidae, the Hispaniolan tanagers",Grey-crowned Tanager,Grey-crowned Palm-Tanager,Phaenicophilus poliocephalus
521,The grey-crowned yellowthroat (Geothlypis poliocephala) is a species of bird in the family Parulidae,grey-crowned yellowthroat,,Geothlypis poliocephala
522,The grey-eared brushfinch or black-faced brushfinch (Atlapetes melanolaemus) is a species of bird in the family Passerellidae,brushfinch,"grey-eared brushfinch, black-faced brushfinch",Atlapetes melanolaemus
523,"The grey-eared honeyeater (Lichmera incana), also known as the dark-brown honeyeater, is a passerine bird of the honeyeater family which is found in Vanuatu and New Caledonia in the south-west Pacific",grey-eared honeyeater,dark-brown honeyeater,Lichmera incana
524,"The grey-eyed bulbul (Iole propinqua) is a species of songbird in the bulbul family, Pycnonotidae",grey-eyed bulbul,,Iole propinqua
525,The grey-eyed greenlet (Hylophilus amaurocephalus) is a species of bird in the family Vireonidae,greenlet,,Hylophilus amaurocephalus
526,The grey-faced buzzard (Butastur indicus) is an Asian bird of prey,grey-faced buzzard,,Butastur indicus
527,The grey-faced petrel (Pterodroma gouldi) is a petrel endemic to the North Island of New Zealand,grey-faced petrel,,Pterodroma gouldi
528,The grey-faced tit-babbler (Mixornis kelleyi) is a species of bird in the family Timaliidae,Grey-faced tit-babbler,,Mixornis kelleyi
529,The grey-flanked cinclodes (Cinclodes oustaleti) is a species of bird in the family Furnariidae,grey-flanked cinclodes,,Cinclodes oustaleti
530,The grey-fronted dove (Leptotila rufaxilla) is a large New World tropical dove,grey-fronted dove,,Leptotila rufaxilla
531,The grey-fronted green pigeon (Treron affinis) is a pigeon in the genus Treron,grey-fronted green pigeon,,Treron affinis
532,The grey-fronted honeyeater (Ptilotula plumula) is a species of bird in the family Meliphagidae,grey-fronted honeyeater,,Ptilotula plumula
533,The grey-fronted quail-dove (Geotrygon caniceps) is a species of bird in the family Columbidae,grey-fronted quail-dove,,Geotrygon caniceps
534,The grey-green fruit dove (Ptilinopus purpuratus) is a species of bird in the family Columbidae,Grey-green Fruit Dove,,Ptilinopus purpuratus
535,The grey-green scrubwren (Aethomyias arfakianus) is a species of bird in the family Acanthizidae,scrubwren,,Aethomyias arfakianus
536,The grey-headed babbler (Stachyris poliocephala) is a species of bird in the family Timaliidae,grey-headed babbler,,Stachyris poliocephala
537,"The grey-headed batis (Batis orientalis) is a species of bird in the wattle-eyes family,  Platysteiridae, it was previously classified with the Old World flycatchers in the  family Muscicapidae",Grey-headed Batis,,Batis orientalis
538,"The grey-headed bristlebill (Bleda canicapillus) is a species of songbird in the bulbul family, Pycnonotidae",grey-headed bristlebill,,Bleda canicapillus
539,The grey-headed broadbill (Smithornis sharpei) is a species of bird in the family Calyptomenidae,grey-headed broadbill,,Smithornis sharpei
540,"The grey-headed bulbul (Brachypodius priocephalus) is a member of the bulbul family, Pycnonotidae",grey-headed bulbul,,Brachypodius priocephalus
541,The grey-headed bullfinch (Pyrrhula erythaca) is a species of finch in the family Fringillidae,grey-headed bullfinch,,Pyrrhula erythaca
542,"The grey-headed bushshrike (Malaconotus blanchoti), colloquially known as the ghostbird,[2] is a species of passerine bird in the family Malaconotidae",grey-headed bushshrike,ghostbird,Malaconotus blanchoti
543,"The grey-headed chachalaca (Ortalis cinereiceps) is a member of an ancient group of birds of the family Cracidae, which includes chachalacas, guans, and curassows",grey-headed chachalaca,"chachalacas, guans, curassows",Ortalis cinereiceps
544,The grey-headed dove (Leptotila plumbeiceps) is a large New World dove,grey-headed dove,,Leptotila plumbeiceps
545,The grey-headed fish eagle (Haliaeetus ichthyaetus) is a fish-eating bird of prey from South East Asia,Grey-headed Fish Eagle,,Haliaeetus ichthyaetus
546,The grey-headed fruit dove (Ptilinopus hyogastrus) is a species of bird in the family Columbidae,Grey-headed fruit dove,,Ptilinopus hyogastrus
547,"The grey-headed goshawk (Accipiter poliocephalus) is a lightly built, medium-sized bird of prey in the family Accipitridae",grey-headed goshawk,,Accipiter poliocephalus
548,"The grey-headed greenbul (Phyllastrephus poliocephalus), or grey-headed yellow-bellied greenbul, is a species of songbird in the bulbul family, Pycnonotidae",Grey-headed Greenbul,Grey-headed Yellow-bellied Greenbul,Phyllastrephus poliocephalus
549,The grey-headed imperial pigeon (Ducula radiata) is a species of bird in the family Columbidae,imperial pigeon,,Ducula radiata
550,"The grey-headed kingfisher (Halcyon leucocephala) is a species of kingfisher that has a wide distribution from the Cape Verde Islands off the north-west coast of Africa to Mauritania, Senegal and Gambia, east to Ethiopia, Somalia and southern Arabia and south to South Africa",Grey-headed Kingfisher,,Halcyon leucocephala
551,The gray-headed lovebird or Madagascar lovebird (Agapornis canus) is a small species of parrot of the lovebird genus,lovebird,"gray-headed lovebird, Madagascar lovebird",Agapornis canus
552,"The grey-headed mannikin or grey-headed munia (Lonchura caniceps) is a species of estrildid finch, native to the Papuan Peninsula",grey-headed mannikin,grey-headed munia,Lonchura caniceps
553,The grey-headed nigrita (Nigrita canicapillus) is a common species of estrildid finch found in Africa,Grey-headed Nigrita,,Nigrita canicapillus
554,"The grey-headed oliveback (Delacourella capistrata), also known as the white-cheeked oliveback, is a common species of estrildid finch found in Africa",grey-headed oliveback,white-cheeked oliveback,Delacourella capistrata
555,The grey-headed parakeet (Psittacula finschii) is closely related to the slaty-headed parakeet which together form a super-species,Grey-headed parakeet,Slaty-headed parakeet,Psittacula finschii
556,The grey-headed parrotbill (Psittiparus gularis) is a parrotbill in the family Sylviidae and is found in eastern Asia from the Himalayas to Indochina and Hainan,Grey-headed Parrotbill,,Psittiparus gularis
557,The grey-headed piprites (Piprites griseiceps) is a species of bird which traditionally has been placed in the family Tyrannidae,Grey-headed piprites,,Piprites griseiceps
558,The grey-headed robin (Heteromyias cinereifrons) is a species of bird in the family Petroicidae,grey-headed robin,,Heteromyias cinereifrons
559,The grey-headed spinetail (Cranioleuca semicinerea) is a species of bird in the family Furnariidae,grey-headed spinetail,,Cranioleuca semicinerea
560,The grey-headed tanager (Eucometis penicillata) is a widely distributed species of small Neotropical bird in the tanager family Thraupidae,grey-headed tanager,,Eucometis penicillata
561,"The grey-headed woodpecker (Picus canus), also known as the grey-faced woodpecker, is a Eurasian member of the woodpecker family, Picidae",Grey-headed woodpecker,Grey-faced woodpecker,Picus canus
562,"The grey-hooded attila (Attila rufus) is a species of bird in the family Tyrannidae, the tyrant flycatchers",Attila rufus,,Grey-hooded Attila
563,The grey-hooded bush tanager (Cnemoscopus rubrirostris) is a species of South American bird in the tanager family Thraupidae,grey-hooded bush tanager,,Cnemoscopus rubrirostris
564,The grey-hooded flycatcher (Mionectes rufiventris) is a species of bird in the family Tyrannidae,Grey-hooded Flycatcher,,Mionectes rufiventris
565,The grey-hooded sierra finch (Phrygilus gayi) is a species of bird in the family Thraupidae,grey-hooded sierra finch,,Phrygilus gayi
566,"The grey-hooded white-eye (Heleia pinaiae), also known as the grey-hooded ibon, is a species of bird in the family Zosteropidae",grey-hooded white-eye,grey-hooded ibon,Heleia pinaiae
567,The greyish eagle-owl or vermiculated eagle-owl (Bubo cinerascens) is a rather large owl of the northern part of sub-Saharan Africa,eagle-owl,"greyish eagle-owl, vermiculated eagle-owl",Bubo cinerascens
568,The greyish miner (Geositta maritima) is a species of bird in the family Furnariidae,greyish miner,,Geositta maritima
569,The greyish mourner (Rhytipterna simplex) is a species of bird in the family Tyrannidae,Rhytipterna simplex,greyish mourner,Rhytipterna simplex
570,The greyish piculet (Picumnus granadensis) is a species of bird in subfamily Picumninae of the woodpecker family Picidae,greyish piculet,,Picumnus granadensis
571,Greyish saltator has been split into three species:,Greyish Saltator,,Saltator coerulescens
572,The greylag goose or graylag goose (Anser anser) is a species of large goose in the waterfowl family Anatidae and the type species of the genus Anser,greylag goose,graylag goose,Anser anser
573,"The grey-legged tinamou (Crypturellus duidae), alternatively, the gray-legged tinamou, is a small ground-dwelling bird endemic to the neotropics",grey-legged tinamou,gray-legged tinamou,Crypturellus duidae
574,The grey-mantled wren (Odontorchilus branickii) is a species of bird in the family Troglodytidae,grey-mantled wren,,Odontorchilus branickii
575,The grey-naped antpitta (Grallaria griseonucha) is a species of bird in the family Grallariidae,Grey-naped antpitta,,Grallaria griseonucha
576,"The grey-necked bunting (Emberiza buchanani), sometimes referred to as grey-hooded bunting (a name also in use for chestnut-eared bunting[3]) is a species of bird in the family Emberizidae",Grey-necked bunting,"Grey-hooded bunting, Chestnut-eared bunting",Emberiza buchanani
577,The grey-necked rockfowl (Picathartes oreas) is a medium-sized bird in the family Picathartidae with a long neck and tail,grey-necked rockfowl,,Picathartes oreas
578,"The grey-olive greenbul (Phyllastrephus cerviniventris), or grey-olive bulbul, is a species of songbird in the bulbul family, Pycnonotidae",grey-olive greenbul,grey-olive bulbul,Phyllastrephus cerviniventris
579,The grey-rumped swallow (Pseudhirundo griseopyga) is a species of swallow,Grey-rumped swallow,,Pseudhirundo griseopyga
580,"The grey-rumped swiftlet (Collocalia marginata) or grey-rumped swiftlet, is a small bird in the swift family Apodidae",grey-rumped swiftlet,,Collocalia marginata
581,The grey-rumped treeswift (Hemiprocne longipennis) is a species of bird in the Hemiprocnidae family,Grey-rumped Treeswift,,Hemiprocne longipennis
582,The grey-sided bush warbler (Cettia brunnifrons) is a species of bush warbler (family Cettiidae),Grey-sided Bush Warbler,,Cettia brunnifrons
583,The grey-sided flowerpecker (Dicaeum celebicum) is a species of bird in the family Dicaeidae,grey-sided flowerpecker,,Dicaeum celebicum
584,The grey-sided scimitar babbler (Erythrogenys swinhoei) is a species of bird in the family Timaliidae,grey-sided scimitar babbler,,Erythrogenys swinhoei
585,"The grey-sided thrush (Turdus feae) is a species of bird in the thrush family, Turdidae",grey-sided thrush,,Turdus feae
586,The grey-streaked flycatcher or grey-spotted flycatcher (Muscicapa griseisticta) is a small passerine bird breeding in the eastern Palearctic belonging to the genus Muscicapa in the Old World flycatcher family Muscicapidae,grey-streaked flycatcher,grey-spotted flycatcher,Muscicapa griseisticta
587,"The grey-streaked honeyeater (Ptiloprora perstriata), also known as the black-backed honeyeater, is a species of bird in the family Meliphagidae",grey-streaked honeyeater,black-backed honeyeater,Ptiloprora perstriata
588,"The grey-tailed mountaingem (Lampornis cinereicauda), also variously spelled gray-tailed mountaingem, grey-tailed mountain-gem, or gray-tailed mountain-gem, is a species of hummingbird in tribe Lampornithini of subfamily Trochilinae",mountaingem,"gray-tailed mountaingem, grey-tailed mountain-gem, gray-tailed mountain-gem",Lampornis cinereicauda
589,The grey-throated babbler (Stachyris nigriceps) is a species of passerine bird in the Old World babbler family Timaliidae,grey-throated babbler,,Stachyris nigriceps
590,The grey-throated barbet (Gymnobucco bonapartei) is a species of bird in the Lybiidae family (African barbets),grey-throated barbet,,Gymnobucco bonapartei
591,"The grey-throated chat (Granatellus sallaei) is a species of bird in the family Cardinalidae, the cardinals or cardinal grosbeaks",Grey-throated chat,,Granatellus sallaei
