,raw,bird,alternate_names,scientific_name
302,"The great-billed heron (Ardea sumatrana) is a wading bird of the heron family, resident from southeast Asia to Papua New Guinea and Australia",great-billed heron,,Ardea sumatrana
303,The great-billed kingfisher or black-billed kingfisher (Pelargopsis melanorhyncha) is a species of bird in the subfamily Halcyoninae,great-billed kingfisher,black-billed kingfisher,Pelargopsis melanorhyncha
304,The great-billed mannikin or grand munia (Lonchura grandis) is a species of estrildid finch found in northern and eastern New Guinea,great-billed mannikin,grand munia,Lonchura grandis
305,"The great-billed parrot (Tanygnathus megalorynchos) also known as Moluccan parrot or island parrot, is a medium-sized, approximately 38 cm long, green parrot with a massive red bill, cream iris, blackish shoulders, olive green back, pale blue rump and yellowish green underparts",Great-billed parrot,"Moluccan parrot, Island parrot",Tanygnathus megalorynchos
307,The greater ani (Crotophaga major) is a bird in the cuckoo family,greater ani,,Crotophaga major
308,The Greater Antillean bullfinch (Melopyrrha violacea) is a species of bird in the family Thraupidae,Greater Antillean bullfinch,,Melopyrrha violacea
309,"The Greater Antillean grackle (Quiscalus niger) is a grackle found throughout the Greater Antilles, as well as smaller nearby islands",Greater Antillean grackle,,Quiscalus niger
310,The greater bird-of-paradise (Paradisaea apoda) is a bird-of-paradise in the genus Paradisaea,greater bird-of-paradise,,Paradisaea apoda
311,The greater blue-eared starling or greater blue-eared glossy-starling (Lamprotornis chalybaeus) is a bird that breeds from Senegal east to Ethiopia and south through eastern Africa to northeastern South Africa and Angola,greater blue-eared starling,greater blue-eared glossy-starling,Lamprotornis chalybaeus
312,"The greater coucal or crow pheasant (Centropus sinensis), is a large non-parasitic member of the cuckoo order of birds, the Cuculiformes",greater coucal,crow pheasant,Centropus sinensis
313,"The greater double-collared sunbird (Cinnyris afer) (formerly placed in the genus Nectarinia), is a small bird in the sunbird family",greater double-collared sunbird,,Cinnyris afer
314,"The greater flameback (Chrysocolaptes guttacristatus) also known as greater goldenback, large golden-backed woodpecker is a woodpecker species",greater flameback,"Greater goldenback, Large golden-backed woodpecker",Chrysocolaptes guttacristatus
315,The greater flamingo (Phoenicopterus roseus) is the most widespread and largest species of the flamingo family,greater flamingo,,Phoenicopterus roseus
316,The greater flowerpiercer (Diglossa major) is a species of bird in the family Thraupidae,Greater flowerpiercer,,Diglossa major
317,The greater green leafbird (Chloropsis sonnerati) is a species of bird in the family Chloropseidae,greater green leafbird,,Chloropsis sonnerati
318,The greater ground robin (Amalocichla sclateriana) is a species of bird in the family Petroicidae,Greater Ground Robin,,Amalocichla sclateriana
319,"The greater honeyguide (Indicator indicator) is a bird in the family Indicatoridae, paleotropical near passerine birds related to the woodpeckers",greater honeyguide,,Indicator indicator
320,"The greater kestrel (Falco rupicoloides) or white-eyed kestrel, is a bird of prey belonging to the falcon family Falconidae",greater kestrel,white-eyed kestrel,Falco rupicoloides
321,"The greater lophorina (Lophorina superba), also known as superb bird-of-paradise or greater superb bird-of-paradise, is a species of the Paradisaeidae (bird-of-paradise) family",greater lophorina,"superb bird-of-paradise, greater superb bird-of-paradise",Lophorina superba
322,The greater painted-snipe (Rostratula benghalensis) is a species of wader in the family Rostratulidae,greater painted-snipe,,Rostratula benghalensis
323,The greater pewee (Contopus pertinax) is a passerine and is in the tyrant flycatcher group,greater pewee,Contopus pertinax,"Passerine, Tyrant Flycatcher"
324,The greater racket-tailed drongo (Dicrurus paradiseus) is a medium-sized Asian bird which is distinctive in having elongated outer tail feathers with webbing restricted to the tips,greater racket-tailed drongo,,Dicrurus paradiseus
325,"The greater roadrunner (Geococcyx californianus) is a long-legged bird in the cuckoo family, Cuculidae, from the Aridoamerica region in the Southwestern United States and Mexico",greater roadrunner,,Geococcyx californianus
326,"The greater sage-grouse (Centrocercus urophasianus), also known as the sagehen, is the largest grouse (a type of bird) in North America",greater sage-grouse,sagehen,Centrocercus urophasianus
327,The greater sand plover (Charadrius leschenaultii) is a small wader in the plover family of birds,greater sand plover,,Charadrius leschenaultii
328,"The American robin, also known as the robin redbreast, is a migratory songbird with the scientific name Turdus migratorius.",American robin,robin redbreast,Turdus migratorius
329,The greater swamp warbler (Acrocephalus rufescens) is a species of Old World warbler in the family Acrocephalidae,Greater Swamp Warbler,,Acrocephalus rufescens
330,The greater thornbird (Phacellodomus ruber) is a species of bird in the family Furnariidae,greater thornbird,,Phacellodomus ruber
331,"The greater vasa parrot (Coracopsis vasa) is one of two species of vasa parrot, the other being the lesser vasa parrot C",Vasa Parrot,"Greater Vasa Parrot, Lesser Vasa Parrot",Coracopsis vasa
332,The greater wagtail-tyrant (Stigmatura budytoides) is a South American species of bird in the family Tyrannidae,greater wagtail-tyrant,,Stigmatura budytoides
333,The greater yellow finch (Sicalis auriventris) is a species of bird in the family Thraupidae,greater yellow finch,,Sicalis auriventris
334,"The greater yellow-headed vulture (Cathartes melambrotus), also known as the forest vulture,[3] is a species of bird in the New World vulture family Cathartidae",greater yellow-headed vulture,forest vulture,Cathartes melambrotus
335,"The great-tailed grackle or Mexican grackle (Quiscalus mexicanus) is a medium-sized, highly social passerine bird native to North and South America",Great-tailed Grackle,Mexican Grackle,Quiscalus mexicanus
336,The great-winged petrel (Pterodroma macroptera) is a petrel,Great-winged petrel,,Pterodroma macroptera
337,"The green araçari (Pteroglossus viridis), is a toucan, a near-passerine bird",Green araçari,Toucan,Pteroglossus viridis
338,Stictospiza formosaEstrilda formosa Sporaeginthus formosus,Stictospiza formosa,"Estrilda formosa, Sporaeginthus formosus",Stictospiza formosa
339,The green-backed twinspot or green twinspot (Mandingoa nitidula) is an estrildid finch found in many parts of Sub-Saharan Africa,Green-backed Twinspot,Green Twinspot,Mandingoa nitidula
340,The green barbet (Stactolaema olivacea) is a species of bird in the Lybiidae family (African barbets),green barbet,,Stactolaema olivacea
342,The green broadbill (Calyptomena viridis) also known as the lesser green broadbill is a small bird in the family Calyptomenidae,green broadbill,lesser green broadbill,Calyptomena viridis
343,"The green catbird (Ailuroedus crassirostris) is a species of bowerbird found in subtropical forests along the east coast of Australia, from southeastern Queensland to southern New South Wales",green catbird,,Ailuroedus crassirostris
344,The green cochoa (Cochoa viridis) is a bird species that was variously placed with the thrushes of family Turdidae or the related Muscicapidae (Old World flycatchers),green cochoa,,Cochoa viridis
345,"The green crombec (Sylvietta virens) is a species of African warbler, formerly placed in the family Sylviidae",Green Crombec,,Sylvietta virens
346,The green figbird or Timor figbird (Sphecotheres viridis) is a species of bird in the family Oriolidae,green figbird,Timor figbird,Sphecotheres viridis
347,"The green hermit (Phaethornis guy) is a large hummingbird that is a resident breeder from southern Central America (Costa Rica and Panama) south to northern South America (north-eastern Venezuela and Trinidad, and the northern Andes of eastern Peru)",Green Hermit,,Phaethornis guy
348,The green honeycreeper (Chlorophanes spiza) is a small bird in the tanager family,green honeycreeper,,Chlorophanes spiza
349,"The green hylia (Hylia prasina) is a monotypic genus widespread in tropical Africa, where it mostly inhabits the understory and mid-stratum of moist forest",Green Hylia,,Hylia prasina
350,"The green ibis (Mesembrinibis cayennensis), also known as the Cayenne ibis, is a wading bird in the ibis family Threskiornithidae",green ibis,Cayenne ibis,Mesembrinibis cayennensis
351,The green imperial pigeon (Ducula aenea) is a large forest pigeon,green imperial pigeon,,Ducula aenea
352,The green iora (Aegithina viridissima) is a species of bird in the family Aegithinidae,green iora,,Aegithina viridissima
353,"The green jay (Cyanocorax luxuosus) is a species of the New World jays, and is found in Central America",Green Jay,,Cyanocorax luxuosus
354,The green jery (Neomixis viridis) is a species of bird in the family Cisticolidae,Green jery,,Neomixis viridis
355,"The green junglefowl (Gallus varius), also known as Javan junglefowl, forktail or green Javanese junglefowl, is the most distantly related and the first to diverge at least 4 million years ago among the four species of the junglefowl",Green Junglefowl,"Javan Junglefowl, Forktail, Green Javanese Junglefowl",Gallus varius
356,"The green longtail (Urolais epichlorus) is a bird species of the family Cisticolidae, in the monotypic genus Urolais",green longtail,,Urolais epichlorus
357,The green malkoha or whistling yellowbill (Ceuthmochares australis) is a species of cuckoo in the family Cuculidae,green malkoha,whistling yellowbill,Ceuthmochares australis
358,The green mango (Anthracothorax viridis) is a large species of hummingbird in the subfamily Polytminae,hummingbird,,Anthracothorax viridis
359,The green oriole or Australasian yellow oriole (Oriolus flavocinctus) is an inconspicuous inhabitant of lush tropical vegetation throughout Australia and New Guinea,green oriole,Australasian yellow oriole,Oriolus flavocinctus
360,The green oropendola (Psarocolius viridis) is a species of bird in the family Icteridae,green oropendola,,Psarocolius viridis
361,"The green parakeet (Psittacara holochlorus) is a medium-sized parrot occurring in North and Central America, from the southernmost tip of Texas south to northern Nicaragua",green parakeet,,Psittacara holochlorus
362,The green peafowl or Indonesian peafowl (Pavo muticus) is a peafowl species native to the tropical forests of Southeast Asia and Indochina,peafowl,"green peafowl, Indonesian peafowl",Pavo muticus
363,The green pygmy goose (Nettapus pulchellus) is a small perching duck which breeds in southern New Guinea and northern Australia,green pygmy goose,small perching duck,Nettapus pulchellus
364,The green racket-tail (Prioniturus luconensis) is an endemic parrot of the Philippines where it is found on Luzon and Marinduque,Green Racket-tail,,Prioniturus luconensis
365,The green rosella or Tasmanian rosella (Platycercus caledonicus) is a species of parrot native to Tasmania and Bass Strait islands,green rosella,Tasmanian rosella,Platycercus caledonicus
366,The green sandpiper (Tringa ochropus) is a small wader (shorebird) of the Old World,green sandpiper,,Tringa ochropus
367,The green shrike-babbler (Pteruthius xanthochlorus) is a bird species that was earlier placed in the family Timaliidae,Green Shrike-Babbler,,Pteruthius xanthochlorus
368,The green shrike-vireo (Vireolanius pulchellus) is a species of bird in the family Vireonidae,Green Shrike-Vireo,,Vireolanius pulchellus
369,The green tinkerbird (Pogoniulus simplex) is a species of bird in the Lybiidae family (African barbets),green tinkerbird,,Pogoniulus simplex
370,"The green warbler (Phylloscopus nitidus), also known as green willow warbler or green leaf warbler, is a leaf warbler found in the Caucasus Mountains in southeastern Europe",Green Warbler,"Green Willow Warbler, Green Leaf Warbler",Phylloscopus nitidus
371,"The green warbler-finch (Certhidea olivacea) is a species of bird, one of Darwin's finches in the tanager family Thraupidae",green warbler-finch,,Certhidea olivacea
372,The green white-eye (Zosterops stuhlmanni) is a bird species in the family Zosteropidae,green white-eye,,Zosterops stuhlmanni
373,"The green wood hoopoe (Phoeniculus purpureus) is a large, up to 44 cm (17 in) long, near-passerine tropical bird native to Africa",green wood hoopoe,,Phoeniculus purpureus
374,The green-and-black fruiteater (Pipreola riefferii) is a species of bird in the family Cotingidae,Fruiteater,,Pipreola riefferii
375,"The green-and-gold tanager (Tangara schrankii) is a species of bird in the family Thraupidae, the tanagers",green-and-gold tanager,,Tangara schrankii
376,"The green-and-white hummingbird (Elliotomyia viridicauda) is a species of hummingbird in the ""emeralds"", tribe Trochilini of subfamily Trochilinae",hummingbird,,Elliotomyia viridicauda
377,The green-backed becard (Pachyramphus viridis) is a species of bird in the family Tityridae,Green-backed Becard,,Pachyramphus viridis
378,"The green-backed camaroptera (Camaroptera brachyura), also known as the bleating camaroptera, is a small bird in the family Cisticolidae",green-backed camaroptera,bleating camaroptera,Camaroptera brachyura
379,The green-backed eremomela (Eremomela canescens) is a member of the Cisticolidae,green-backed eremomela,,Eremomela canescens
380,"The green-backed firecrown (Sephanoides sephaniodes) is a hummingbird in the ""coquettes"", tribe Lesbiini of subfamily Lesbiinae",Green-backed Firecrown,,Sephanoides sephaniodes
381,The green-backed gerygone (Gerygone chloronota) is a species of bird in the family Acanthizidae found in northern Australia and New Guinea,Gerygone chloronota,green-backed gerygone,Gerygone chloronota
382,"The green-backed hillstar (Urochroa leucura), formerly included in the white-tailed hillstar, is a species of hummingbird in the ""brilliants"", tribe Heliantheini in subfamily Lesbiinae",green-backed hillstar,white-tailed hillstar,Urochroa leucura
383,"The green-backed honeybird (Prodotiscus zambesiae), also known as the eastern green-backed honeyguide, green-backed honeyguide and slender-billed honeyguide, is a species of bird in the family Indicatoridae",green-backed honeybird,"eastern green-backed honeyguide, green-backed honeyguide, slender-billed honeyguide",Prodotiscus zambesiae
384,The green-backed honeyeater (Glycichaera fallax) is a species of bird in the family Meliphagidae,Green-backed honeyeater,,Glycichaera fallax
385,"The green-backed kingfisher (Actenoides monachus) is a species of bird in the family Alcedinidae endemic to Indonesia, where it is restricted to north and central Sulawesi, and the islands of Manadotua and Lembeh",Green-backed Kingfisher,,Actenoides monachus
386,The green-backed robin (Pachycephalopsis hattamensis) is a species of bird in the family Petroicidae,green-backed robin,,Pachycephalopsis hattamensis
387,"The green-backed sparrow (Arremonops chloronotus) is a species of bird in the family Passerellidae that is found in Belize, northern Guatemala, western Honduras and southern Mexico",Green-backed sparrow,,Arremonops chloronotus
388,The green-backed tit (Parus monticolus) is a species of bird in the family Paridae,green-backed tit,,Parus monticolus
389,The green-backed white-eye (Zosterops xanthochroa) is a species of bird in the family Zosteropidae,green-backed white-eye,,Zosterops xanthochroa
390,The green-barred woodpecker or green-barred flicker (Colaptes melanochloros) is a species of bird in subfamily Picinae of the woodpecker family Picidae,Green-barred woodpecker,green-barred flicker,Colaptes melanochloros
391,The green-billed malkoha (Phaenicophaeus tristis) is a species of non-parasitic cuckoo found throughout Indian Subcontinent and Southeast Asia,green-billed malkoha,,Phaenicophaeus tristis
392,"The green-billed toucan (Ramphastos dicolorus), or red-breasted toucan, is a near-passerine bird in the family Ramphastidae, the toucans, toucanets, and aracaris",green-billed toucan,red-breasted toucan,Ramphastos dicolorus
393,The green-breasted bushshrike or gladiator bushshrike (Malaconotus gladiator) is a species of bird in the family Malaconotidae,Green-breasted Bushshrike,Gladiator Bushshrike,Malaconotus gladiator
394,The green-breasted mango or Prevost's mango (Anthracothorax prevostii) is a species in subfamily Polytminae of the hummingbird family Trochilidae,green-breasted mango,Prevost's mango,Anthracothorax prevostii
395,The green-breasted mountaingem or green-breasted mountain-gem (Lampornis sybillae) is a species of hummingbird in tribe Lampornithini of subfamily Trochilinae,Green-breasted Mountaingem,Green-breasted Mountain-gem,Lampornis sybillae
396,The green-breasted pitta (Pitta reichenowi) is a species of bird in the family Pittidae,Green-breasted pitta,,Pitta reichenowi
397,"The green-capped eremomela or greencap eremomela (Eremomela scotops) is a species of bird formerly placed in the ""Old World warbler"" assemblage, but now placed in the family Cisticolidae",Green-capped Eremomela,Greencap Eremomela,Eremomela scotops
398,The green-capped tanager (Stilpnia meyerdeschauenseei) is a species of bird in the family Thraupidae,green-capped tanager,,Stilpnia meyerdeschauenseei
399,"The green-cheeked parakeet (Pyrrhura molinae), known as the  green-cheeked conure in aviculture, is a species of bird in subfamily Arinae of the family Psittacidae, the African and New World parrots",green-cheeked parakeet,green-cheeked conure,Pyrrhura molinae
400,The green-chinned euphonia (Euphonia chalybea) is a species of bird in the family Fringillidae,green-chinned euphonia,,Euphonia chalybea
401,"The green-crowned brilliant (Heliodoxa jacula) is species of hummingbird in the ""brilliants"", tribe Heliantheini in subfamily Lesbiinae",Green-crowned Brilliant,,Heliodoxa jacula
402,"The green-faced parrotfinch (Erythrura viridifacies) is a species of estrildid finch found in northern Philippines, on Luzon, Mindoro, Panay, Negros and Cebu islands",Green-faced Parrotfinch,,Erythrura viridifacies
403,The green-fronted lancebill (Doryfera ludovicae) is a species of hummingbird in the family Trochilidae,Green-fronted lancebill,,Doryfera ludovicae
404,"The green-headed oriole (Oriolus chlorocephalus), or montane oriole, is a species of bird in the family Oriolidae",green-headed oriole,montane oriole,Oriolus chlorocephalus
405,"The green-headed tanager (Tangara seledon) is a brightly colored bird found in the Atlantic forest in south-eastern Brazil, far eastern Paraguay, and far north-eastern Argentina (Misiones only)",green-headed tanager,,Tangara seledon
406,"The greenish elaenia (Myiopagis viridicata) is a species of bird in the family Tyrannidae, the tyrant flycatchers",greenish elaenia,,Myiopagis viridicata
407,"The greenish puffleg (Haplophaedia aureliae) is a species of hummingbird in the ""brilliants"", tribe Heliantheini in subfamily Lesbiinae",Greenish Puffleg,,Haplophaedia aureliae
408,"The greenish schiffornis (Schiffornis virescens), also greenish mourner or greenish manakin (not to be confused with the green manakin), is a species of bird in the family Tityridae",Greenish Schiffornis,"Greenish Mourner, Greenish Manakin",Schiffornis virescens
409,The greenish tyrannulet (Phyllomyias virescens) is a species of bird in the family Tyrannidae,Greenish Tyrannulet,,Phyllomyias virescens
410,The greenish yellow finch (Sicalis olivascens) is a species of bird in the family Thraupidae,greenish yellow finch,,Sicalis olivascens
411,"The green-legged partridge (Tropicoperdix chloropus), also known as the scaly-breasted partridge or green-legged hill-partridge, is a bird species in the family Phasianidae",green-legged partridge,"scaly-breasted partridge, green-legged hill-partridge",Tropicoperdix chloropus
412,The green-naped tanager (Tangara fucosa) is a species of bird in the family Thraupidae,green-naped tanager,,Tangara fucosa
413,The green-rumped parrotlet (Forpus passerinus) is a species of parrot in the family Psittacidae that is found in northeastern South America and the Caribbean island of Trinidad,green-rumped parrotlet,,Forpus passerinus
414,"The green-tailed bristlebill (Bleda eximius) is a species of songbird in the bulbul family, Pycnonotidae",green-tailed bristlebill,,Bleda eximius
415,"The green-tailed goldenthroat (Polytmus theresiae) is a species of hummingbird in the subfamily Polytminae, the mangoes",Green-tailed Goldenthroat,,Polytmus theresiae
416,The green-tailed sunbird (Aethopyga nipalensis) or Nepal yellow-backed sunbird is a species of bird in the family Nectariniidae,green-tailed sunbird,Nepal yellow-backed sunbird,Aethopyga nipalensis
417,"The green-tailed towhee (Pipilo chlorurus) is the smallest towhee, but is still one of the larger members of the American sparrow family Passerellidae",Green-tailed Towhee,,Pipilo chlorurus
418,"The green-tailed trainbearer (Lesbia nuna) is a species of hummingbird in the ""coquettes"", tribe Lesbiini of subfamily Lesbiinae",Green-tailed Trainbearer,,Lesbia nuna
419,"The green-tailed warbler (Microligea palustris), also known as the green-tailed ground-tanager, is a species of bird of the family Phaenicophilidae, the Hispaniolan tanagers",green-tailed warbler,green-tailed ground-tanager,Microligea palustris
420,The green-throated mango (Anthracothorax viridigula) is a species of hummingbird in the subfamily Polytminae,hummingbird,green-throated mango,Anthracothorax viridigula
421,The green-throated mountaingem or green-throated mountain-gem (Lampornis viridipallens) is a species of hummingbird in tribe Lampornithini of subfamily Trochilinae,Green-throated Mountaingem,Green-throated Mountain-gem,Lampornis viridipallens
422,The green-throated sunbird (Chalcomitra rubescens) is a species of bird in the family Nectariniidae,green-throated sunbird,,Chalcomitra rubescens
423,The green-winged saltator (Saltator similis) is a species of saltator in the family Thraupidae,green-winged saltator,,Saltator similis
424,The Grenada dove  (Leptotila wellsi) is a medium-sized New World tropical dove,Grenada dove,,Leptotila wellsi
425,The Grenada flycatcher (Myiarchus nugator) is a species of bird in the family Tyrannidae,Grenada flycatcher,,Myiarchus nugator
426,The grey antbird (Cercomacra cinerascens) is a species of bird in the antbird family Thamnophilidae,Grey Antbird,,Cercomacra cinerascens
427,The grey antwren (Myrmotherula menetriesii) is a species of bird in the family Thamnophilidae,Grey Antwren,,Myrmotherula menetriesii
428,The grey apalis (Apalis cinerea) is a species of bird in the family Cisticolidae,Apalis cinerea,Grey Apalis,Apalis cinerea
429,The grey bunting (Emberiza variabilis) is a species of bird in the family Emberizidae,grey bunting,,Emberiza variabilis
430,The grey bush chat (Saxicola ferreus) is a species of passerine bird in the family Muscicapidae,Grey Bush Chat,,Saxicola ferreus
431,"The gray crow (Corvus tristis), formerly known as the bare-faced crow, is about the same size (42–45 cm in length) as the Eurasian carrion crow (Corvus corone) but has somewhat different proportions and quite atypical feather pigmentation during the juvenile phase for a member of this genus",gray crow,bare-faced crow,Corvus tristis
432,"The grey crowned crane (Balearica regulorum), also known as the African crowned crane, golden crested crane, golden crowned crane, East African crane, East African crowned crane, African crane, Eastern crowned crane, Kavirondo crane, South African crane and crested crane, is a bird in the crane family, Gruidae",grey crowned crane,"Balearica regulorum, African crowned crane, Golden crested crane, Golden crowned crane, East African crane, East African crowned crane, African crane, Eastern crowned crane, Kavirondo crane, South African crane, Crested crane",Balearica regulorum
433,The grey cuckooshrike (Ceblepyris caesius) is a species of bird in the cuckooshrike family Campephagidae,Grey Cuckooshrike,,Ceblepyris caesius
435,"The grey falcon (Falco hypoleucos) is a medium-sized falcon native to Australia, possibly the rarest",Grey Falcon,,Falco hypoleucos
436,The grey friarbird (Philemon kisserensis) is a species of bird in the family Meliphagidae,grey friarbird,,Philemon kisserensis
437,"The grey go-away-bird (Corythaixoides concolor), also known as grey lourie, grey loerie, or kwêvoël, is a bold and common bird of the southern Afrotropics",Grey Go-Away-Bird,"Grey Lourie, Grey Loerie, Kwêvoël",Corythaixoides concolor
438,"The grey goshawk (Accipiter novaehollandiae) is a strongly built, medium-sized bird of prey in the family Accipitridae that is found in eastern and northern Australia",grey goshawk,,Accipiter novaehollandiae
439,"The grey heron (Ardea cinerea) is a long-legged wading bird of the heron family, Ardeidae, native throughout temperate Europe and Asia and also parts of Africa",grey heron,,Ardea cinerea
440,The grey hypocolius[3] or simply hypocolius (Hypocolius ampelinus) is a small passerine bird species,Hypocolius ampelinus,"Grey Hypocolius, Hypocolius",Hypocolius ampelinus
441,The grey imperial pigeon (Ducula pickeringii) is a species of bird in the family Columbidae,grey imperial pigeon,,Ducula pickeringii
442,"The gray junglefowl (Gallus sonneratii), also known as Sonnerat's junglefowl, is one of the wild ancestors of the domestic chicken together with the red junglefowl and other junglefowls",gray junglefowl,"[""Sonnerats junglefowl""]",Gallus sonneratii
443,The grey kestrel (Falco ardosiaceus) is an African bird of prey belonging to the falcon family Falconidae,grey kestrel,,Falco ardosiaceus
444,The grey laughingthrush (Garrulax maesi) is a species of bird in the family Leiothrichidae,grey laughingthrush,,Garrulax maesi
