,raw,bird,alternate_names,scientific_name
151,The golden nightjar (Caprimulgus eximius) is a species of nightjar in the family Caprimulgidae,golden nightjar,,Caprimulgus eximius
152,"The golden palm weaver (Ploceus bojeri) is a species of bird in the weaver family, Ploceidae",golden palm weaver,,Ploceus bojeri
153,"The golden pipit (Tmetothylacus tenellus) is a distinctive pipit of dry country grassland, savanna and shrubland in eastern Africa",golden pipit,,Tmetothylacus tenellus
154,The golden tanager (Tangara arthus) is a species of bird in the family Thraupidae,golden tanager,,Tangara arthus
155,The golden vireo (Vireo hypochryseus) is a species of bird in the family Vireonidae,golden vireo,,Vireo hypochryseus
156,The golden-backed bishop (Euplectes aureus) is a species of bird in the family Ploceidae,golden-backed bishop,,Euplectes aureus
157,"The golden-backed weaver (Ploceus jacksoni), also known as Jackson's weaver, is a species of bird in the family Ploceidae",golden-backed weaver,Jacksons weaver,Ploceus jacksoni
158,"The golden-backed whistler (Pachycephala aurea) or yellow-backed whistler, is a species of bird in the family Pachycephalidae",golden-backed whistler,yellow-backed whistler,Pachycephala aurea
159,The golden-bellied flycatcher (Myiodynastes hemichrysus) is a passerine bird in the tyrant flycatcher family,golden-bellied flycatcher,,Myiodynastes hemichrysus
160,The golden-bellied flyrobin (Microeca hemixantha) is a species of bird in the family Petroicidae,flyrobin,,Microeca hemixantha
161,The golden-bellied gerygone (Gerygone sulphurea) is a species of bird in the family Acanthizidae,Gerygone sulphurea,Golden-bellied Gerygone,Gerygone sulphurea
162,"The golden-bellied starfrontlet (Coeligena bonapartei) is a species of hummingbird in the ""brilliants"", tribe Heliantheini in subfamily Lesbiinae",starfrontlet,,Coeligena bonapartei
163,The golden-bellied warbler has been split into two species:,Golden-bellied Warbler,,Setophaga chrysoparia
164,The golden-bellied white-eye (Zosterops uropygialis) is a species of bird in the family Zosteropidae,golden-bellied white-eye,,Zosterops uropygialis
165,The golden-billed saltator (Saltator aurantiirostris) is a species of saltator in the family Thraupidae,golden-billed saltator,,Saltator aurantiirostris
166,The golden-breasted bunting (Emberiza flaviventris) is a passerine bird in the bunting family Emberizidae,golden-breasted bunting,,Emberiza flaviventris
167,The golden-breasted fruiteater (Pipreola aureopectus) is a species of bird in the family Cotingidae,golden-breasted fruiteater,,Pipreola aureopectus
168,"The golden-breasted fulvetta (Lioparus chrysotis) is a species of songbird found in Bhutan, China, India, Myanmar, Nepal, and Vietnam",golden-breasted fulvetta,,Lioparus chrysotis
169,"The golden-breasted puffleg (Eriocnemis mosquera) is a species of hummingbird in the ""brilliants"", tribe Heliantheini in subfamily Lesbiinae",golden-breasted puffleg,,Eriocnemis mosquera
170,"The golden-breasted starling (Lamprotornis regius), also known as royal starling, is a medium-sized passerine in the starling family",golden-breasted starling,royal starling,Lamprotornis regius
171,The golden-browed chat-tyrant (Silvicultrix pulchella) is a species of passerine bird in the family Tyrannidae,Golden-browed chat-tyrant,,Silvicultrix pulchella
172,The golden-browed chlorophonia (Chlorophonia callophrys) is a species of bird in the family Fringillidae,golden-browed chlorophonia,,Chlorophonia callophrys
173,"The golden-browed warbler (Basileuterus belli) is a species of bird in the family Parulidae, the New World warblers",golden-browed warbler,,Basileuterus belli
174,The golden-cheeked woodpecker (Melanerpes chrysogenys) is a species of bird in subfamily Picinae of the woodpecker family Picidae,golden-cheeked woodpecker,,Melanerpes chrysogenys
175,The golden-chested tanager (Bangsia rothschildi) is a species of bird in the family Thraupidae,golden-chested tanager,,Bangsia rothschildi
176,The golden-chevroned tanager (Thraupis ornata) is a species of bird in the family Thraupidae,golden-chevroned tanager,,Thraupis ornata
177,The golden-collared honeycreeper (Iridophanes pulcherrimus) is an uncommon species of Neotropical bird in the tanager family Thraupidae,golden-collared honeycreeper,,Iridophanes pulcherrimus
178,"The golden-collared macaw or yellow-collared macaw (Primolius auricollis) is a small mostly green Central South American parrot, a member of a large group of Neotropical parrots known as macaws",macaw,"golden-collared macaw, yellow-collared macaw",Primolius auricollis
179,The golden-collared manakin (Manacus vitellinus) is a species of bird in the family Pipridae,golden-collared manakin,,Manacus vitellinus
180,The golden-collared tanager (Iridosornis jelskii) is a species of bird in the family Thraupidae,golden-collared tanager,,Iridosornis jelskii
181,"The golden-crested myna (Ampeliceps coronatus) is a species in the starling and myna family, Sturnidae",golden-crested myna,,Ampeliceps coronatus
182,The golden-crowned babbler (Sterrhoptilus dennistouni) is a species of bird in the family Zosteropidae,golden-crowned babbler,,Sterrhoptilus dennistouni
183,The golden-crowned flycatcher (Myiodynastes chrysocephalus) is a species of bird in the family Tyrannidae,golden-crowned flycatcher,,Myiodynastes chrysocephalus
184,The golden-crowned kinglet (Regulus satrapa) is a very small songbird in the family Regulidae that lives throughout much of North America,golden-crowned kinglet,,Regulus satrapa
185,The golden-crowned spadebill (Platyrinchus coronatus) is a species of bird in the family Tyrannidae,golden-crowned spadebill,,Platyrinchus coronatus
186,The golden-crowned tanager (Iridosornis rufivertex) is a species of bird in the family Thraupidae,golden-crowned tanager,,Iridosornis rufivertex
187,The golden-crowned warbler (Basileuterus culicivorus) is a small New World warbler,golden-crowned warbler,,Basileuterus culicivorus
188,The golden-eared tanager (Tangara chrysotis) is a species of bird in the tanager family Thraupidae,golden-eared tanager,,Tangara chrysotis
189,The goldenface (Pachycare flavogriseum) is a species of passerine bird endemic to New Guinea,Goldenface,,Pachycare flavogriseum
190,The golden-faced tyrannulet (Zimmerius chrysops) is a species of bird belonging to the family Tyrannidae,golden-faced tyrannulet,,Zimmerius chrysops
191,"The golden-fronted bowerbird (Amblyornis flavifrons) is a medium-sized, approximately 24 cm long, brown bowerbird",golden-fronted bowerbird,,Amblyornis flavifrons
192,"The golden-fronted fulvetta (Schoeniparus variegaticeps), also known as the gold-fronted fulvetta, is a species of bird in the family Pellorneidae",golden-fronted fulvetta,gold-fronted fulvetta,Schoeniparus variegaticeps
193,The golden-fronted leafbird (Chloropsis aurifrons) is a species of leafbird,Golden-fronted Leafbird,,Chloropsis aurifrons
194,"The golden-fronted whitestart (Myioborus ornatus) or the golden-fronted redstart, is a species of bird in the family Parulidae",golden-fronted whitestart,golden-fronted redstart,Myioborus ornatus
195,The golden-fronted woodpecker (Melanerpes aurifrons) is a species of bird in subfamily Picinae of the woodpecker family Picidae,golden-fronted woodpecker,,Melanerpes aurifrons
196,The golden-green woodpecker (Piculus chrysochloros) is a species of bird in subfamily Picinae of the woodpecker family Picidae,golden-green woodpecker,,Piculus chrysochloros
197,"The golden-headed cisticola (Cisticola exilis), also known as the bright-capped cisticola, is a species of warbler in the family Cisticolidae, found in Australia and thirteen Asian countries",golden-headed cisticola,bright-capped cisticola,Cisticola exilis
198,"The golden-headed manakin (Ceratopipra erythrocephala) is a small passerine bird which breeds in tropical Central and South America in both wet and dry forests, secondary growth and plantations",golden-headed manakin,,Ceratopipra erythrocephala
199,The golden-headed quetzal or corequenque (Pharomachrus auriceps) is a strikingly coloured bird in the genus Pharomachrus; it is also referred to as Trogon auriceps,golden-headed quetzal,"corequenque, Trogon auriceps",Pharomachrus auriceps
200,The golden-hooded tanager (Stilpnia larvata) is a medium-sized passerine bird,golden-hooded tanager,,Stilpnia larvata
201,The golden-mantled racket-tail (Prioniturus platurus) is a species of parrot in the family Psittaculidae,Golden-mantled Racket-tail,,Prioniturus platurus
202,The golden-naped finch (Pyrrhoplectes epauletta) is a species of finch in the family Fringillidae,golden-naped finch,,Pyrrhoplectes epauletta
203,The golden-naped tanager (Chalcothraupis ruficervix) is a species of bird in the tanager family Thraupidae,golden-naped tanager,,Chalcothraupis ruficervix
204,The golden-naped weaver (Ploceus aureonucha) is a species of bird in the family Ploceidae,golden-naped weaver,,Ploceus aureonucha
205,The golden-naped woodpecker (Melanerpes chrysauchen) is a species of bird in the woodpecker family Picidae,golden-naped woodpecker,,Melanerpes chrysauchen
206,The golden-olive woodpecker (Colaptes rubiginosus) is a species of bird in subfamily Picinae of the woodpecker family Picidae,golden-olive woodpecker,,Colaptes rubiginosus
207,"The golden-plumed parakeet (Leptosittaca branickii) is a Neotropical parrot species within the family Psittacidae, belonging to the monotypic genus Leptosittaca",golden-plumed parakeet,Leptosittaca branickii,"Psittacidae, Leptosittaca"
208,The golden-rumped flowerpecker (Dicaeum annae) is a species of bird in the family Dicaeidae,golden-rumped flowerpecker,,Dicaeum annae
209,The golden-sided euphonia (Euphonia cayennensis) is a species of bird in the family Fringillidae,golden-sided euphonia,,Euphonia cayennensis
210,The golden-spangled piculet (Picumnus exilis) is a species of bird in subfamily Picumninae of the woodpecker family Picidae,golden-spangled piculet,,Picumnus exilis
211,The golden-spotted ground dove (Metriopelia aymara) is a species of bird in the family Columbidae,Golden-spotted ground dove,,Metriopelia aymara
212,"The golden-tufted mountain grackle (Macroagelaius imthurni), also known as the golden-tufted grackle, is a species of bird in the family Icteridae",golden-tufted mountain grackle,golden-tufted grackle,Macroagelaius imthurni
213,The golden-winged cacique (Cacicus chrysopterus) is a species of bird in the family Icteridae,golden-winged cacique,,Cacicus chrysopterus
214,The golden-winged manakin (Masius chrysopterus) is a species of bird in the family Pipridae,golden-winged manakin,,Masius chrysopterus
215,The golden-winged sparrow (Arremon schlegeli) is a species of bird in the family Passerellidae that can found in Colombia and Venezuela,golden-winged sparrow,,Arremon schlegeli
216,The golden-winged sunbird (Drepanorhynchus reichenowi) is a species of bird in the family Nectariniidae,golden-winged sunbird,,Drepanorhynchus reichenowi
217,"The golden-winged tody-flycatcher (Poecilotriccus calopterus) is a species of bird in the family Tyrannidae, and one of twelve in the genus Poecilotriccus",golden-winged tody-flycatcher,,Poecilotriccus calopterus
218,The golden-winged warbler (Vermivora chrysoptera) is a New World warbler,golden-winged warbler,Vermivora chrysoptera,New World warbler
219,Goldie's bird-of-paradise (Paradisaea decora) is a species of bird-of-paradise,Goldie's bird-of-paradise,,Paradisaea decora
220,Goldie's lorikeet (Glossoptilus goldiei) is a species of parrot in the family Psittaculidae,lorikeet,,Glossoptilus goldiei
221,Goldman's warbler (Setophaga goldmani) is a songbird species in the New World warbler family (Parulidae),Goldman's warbler,,Setophaga goldmani
222,"The gold-ringed tanager (Bangsia aureocincta) is a species of bird in the family Thraupidae, endemic to Colombia",gold-ringed tanager,,Bangsia aureocincta
223,The goliath coucal (Centropus goliath) is a species of cuckoo in the family Cuculidae,Goliath Coucal,,Centropus goliath
224,"The goliath imperial pigeon (Ducula goliath), also known as the New Caledonian imperial pigeon[2] and the notou,[3] is a species of bird in the family Columbidae",Goliath Imperial Pigeon,"New Caledonian Imperial Pigeon, Notou",Ducula goliath
225,"The gorgeted puffleg (Eriocnemis isabellae) is a Critically Endangered species of hummingbird in the ""brilliants"", tribe Heliantheini in subfamily Lesbiinae",Gorgeted puffleg,,Eriocnemis isabellae
226,"The gorgeted sunangel (Heliangelus strophianus) is a species of hummingbird in the ""coquettes"", tribe Lesbiini of subfamily Lesbiinae",gorgeted sunangel,,Heliangelus strophianus
227,The rare gorgeted wood quail (Odontophorus strophium) is a small ground-dwelling bird,gorgeted wood quail,,Odontophorus strophium
228,Gosling's apalis (Apalis goslingi) is a species of bird in the family Cisticolidae,Gosling's Apalis,,Apalis goslingi
229,"Gosling's bunting[2] (Emberiza goslingi), also known as the grey-throated bunting,[1] is a species of bird in the family Emberizidae",Gosling's bunting,grey-throated bunting,Emberiza goslingi
230,"The Gough moorhen (Gallinula comeri) is a medium-sized, almost flightless bird that is similar to the common moorhen (Gallinula chloropus), but is smaller, stockier, and has shorter wings",Gough moorhen,common moorhen,Gallinula comeri
231,"The Gouldian finch (Chloebia gouldiae), also known as the Lady Gouldian finch, Gould's finch or the rainbow finch, is a colourful passerine bird that is native to Australia",Gouldian finch,"Lady Gouldian finch, ""Goulds finch"", rainbow finch",Chloebia gouldiae
232,Gould's emerald (Riccordia elegans) is an extinct species of hummingbird in the family Trochilidae,hummingbird,Goulds emerald,Riccordia elegans
233,Gould's frogmouth (Batrachostomus stellatus) is a nocturnal species of bird in the order Caprimulgiformes and the family Podargidae,Gould's frogmouth,,Batrachostomus stellatus
234,Gould's jewelfront or Gould's brilliant  (Heliodoxa aurescens) is a medium-sized hummingbird in the family Trochilidae,Gould's jewelfront,Goulds brilliant,Heliodoxa aurescens
235,Gould's petrel (Pterodroma leucoptera) is a species of seabird in the family Procellariidae,Gould's petrel,,Pterodroma leucoptera
236,Gould's toucanet (Selenidera gouldii) is a near-passerine bird in the toucan family Ramphastidae,Gould's toucanet,,Selenidera gouldii
237,The graceful honeyeater (Microptilotis gracilis) is a species of bird in the family Meliphagidae,honeyeater,,Microptilotis gracilis
238,"The graceful pitta (Erythropitta venusta), sometimes alternatively known as the black-crowned pitta (although this term is more regularly applied to E",pitta,black-crowned pitta,Erythropitta venusta
239,The graceful prinia (Prinia gracilis) is a small warbler (in some older works it is referred to as graceful warbler),Prinia gracilis,Graceful Warbler,Prinia gracilis
240,Grace's warbler (Setophaga graciae) is a small New World warbler that specializes in pine woods,Grace's warbler,,Setophaga graciae
241,The Grand Comoro brush warbler (Nesillas brevicaudata) is a species of Old World warbler in the family Acrocephalidae,Grand Comoro brush warbler,,Nesillas brevicaudata
242,"The Grand Comoro bulbul (Hypsipetes parvirostris) is a species of songbird in the bulbul family, Pycnonotidae",Grand Comoro bulbul,,Hypsipetes parvirostris
243,The Grand Comoro drongo (Dicrurus fuscipennis) is a species of bird in the family Dicruridae,Grand Comoro drongo,,Dicrurus fuscipennis
244,"The grand rhabdornis (Rhabdornis grandis), also known as the long-billed rhabdornis or long-billed creeper, is a species of bird currently placed in the starling family, Sturnidae",grand rhabdornis,"long-billed rhabdornis, long-billed creeper",Rhabdornis grandis
245,The grandala (Grandala coelicolor) is a species of bird in the thrush family Turdidae,Grandala,,Grandala coelicolor
246,Grant's bluebill (Spermophaga poliogenys) is a species of estrildid finch found in forests in central Africa in subtropical forests or in moist lowlands,Grant's bluebill,Spermophaga poliogenys,Estrildid Finch
247,The grass wren (Cistothorus platensis) is a species of passerine bird in the family Troglodytidae,Grass Wren,,Cistothorus platensis
248,The grass-green tanager (Chlorornis riefferii) is a small South America bird in the tanager family Thraupidae,grass-green tanager,,Chlorornis riefferii
249,The grasshopper buzzard (Butastur rufipennis) is a species of bird of prey in the family Accipitridae which is found in a narrow zone of sub-Saharan Africa north of the equator,grasshopper buzzard,,Butastur rufipennis
250,The grassland sparrow (Ammodramus humeralis) is a species of bird in the family Passerellidae,Grassland Sparrow,,Ammodramus humeralis
251,"Grauer's broadbill (Pseudocalyptomena graueri), also known as the African green broadbill, is a species of bird in the family Eurylaimidae, and is monotypic within the genus Pseudocalyptomena",Grauer's broadbill,African green broadbill,Pseudocalyptomena graueri
252,Grauer's swamp warbler (Bradypterus graueri) is a species of Old World warbler in the family Locustellidae,Grauer's swamp warbler,,Bradypterus graueri
253,Grauer's warbler (Graueria vittata) is a species of Old World warbler in the family Acrocephalidae,Grauer's warbler,,Graueria vittata
254,The gray-barred wren (Campylorhynchus megalopterus) is a species of bird in the family Troglodytidae,gray-barred wren,,Campylorhynchus megalopterus
255,"The gray kingbird or grey kingbird (Tyrannus dominicensis), also known as pitirre, petchary or white-breasted kingbird, is a passerine bird in the tyrant flycatchers family Tyrannidae",gray kingbird,"pitirre, petchary, white-breasted kingbird",Tyrannus dominicensis
256,The gray thrasher (Toxostoma cinereum) is a medium-sized passerine bird belonging to the family Mimidae,gray thrasher,,Toxostoma cinereum
257,The gray vireo (Vireo vicinior) is a small North American passerine bird,gray vireo,,Vireo vicinior
258,The gray-headed kite (Leptodon cayanensis) is a raptor found in open woodland and swamp forests,gray-headed kite,,Leptodon cayanensis
259,The gray-throated warbling finch (Microspingus cabanisi) is a species of bird in the family Thraupidae,gray-throated warbling finch,,Microspingus cabanisi
260,The great antpitta (Grallaria excelsa) is a species of bird in the family Grallariidae,great antpitta,,Grallaria excelsa
261,"The great antshrike (Taraba major) is a passerine bird in the antbird family, Thamnophilidae",antshrike,,Taraba major
262,The great argus (Argusianus argus) is a species of pheasant from Southeast Asia,argus,,Argusianus argus
263,The great auk (Pinguinus impennis) is a species of flightless alcid that became extinct in the mid-19th century,great auk,,Pinguinus impennis
264,"The great barbet (Psilopogon virens) is an Asian barbet native to the Indian sub-continent and Southeast Asia, where it inhabits foremost forests up to 3,000 m (9,800 ft) altitude",Great barbet,,Psilopogon virens
265,"The great black hawk (Buteogallus urubitinga) is a bird of prey in the family Accipitridae, which also includes the eagles, hawks, and Old World vultures",great black hawk,,Buteogallus urubitinga
266,The great black-backed gull (Larus marinus) is the largest member of the gull family,Great black-backed gull,,Larus marinus
267,"The great blue heron (Ardea herodias) is a large wading bird in the heron family Ardeidae, common near the shores of open water and in wetlands over most of North America and Central America, as well as far northwestern South America, the Caribbean and the Galápagos Islands",great blue heron,,Ardea herodias
268,The great blue turaco (Corythaeola cristata) is a bird species of the  family Musophagidae,great blue turaco,,Corythaeola cristata
269,"The great bowerbird (Chlamydera nuchalis) is a common and conspicuous resident of northern Australia, from the area around Broome across the Top End to Cape York Peninsula and as far south as Mount Isa",Great Bowerbird,,Chlamydera nuchalis
270,"The great bustard (Otis tarda) is a bird in the bustard family, and it is the only living member of the genus Otis",great bustard,,Otis tarda
271,The great cuckoo-dove (Reinwardtoena reinwardti) is a species of bird in the family Columbidae,cuckoo-dove,,Reinwardtoena reinwardti
272,"The great curassow (Crax rubra) is a large, pheasant-like bird from the Neotropical rainforests, its range extending from eastern Mexico, through Central America to western Colombia and northwestern Ecuador",great curassow,,Crax rubra
273,The great eared nightjar (Lyncornis macrotis) is a species of nightjar in the family Caprimulgidae,Great eared nightjar,,Lyncornis macrotis
274,"The great egret (Ardea alba), also known as the common egret, large egret, or (in the Old World) great white egret[2] or great white heron[3][4][5] is a large, widely distributed egret",great egret,"common egret, large egret, great white egret, great white heron",Ardea alba
275,"The great grey owl (Strix nebulosa) (also great gray owl in American English) is a very large owl, documented as the world's largest species of owl by length",Great Grey Owl,great gray owl,Strix nebulosa
276,"The great hanging parrot (Loriculus stigmatus), also called Celebes hanging parrot, Sulawesi hanging parrot and maroon-rumped hanging parrot, is a species of parrot in the family Psittaculidae",great hanging parrot,"Celebes hanging parrot, Sulawesi hanging parrot, maroon-rumped hanging parrot",Loriculus stigmatus
277,The great iora (Aegithina lafresnayei) is a species of bird in the family Aegithinidae,great iora,,Aegithina lafresnayei
278,The great jacamar (Jacamerops aureus) is a species of bird in the family Galbulidae,jacamar,,Jacamerops aureus
279,"The great kiskadee (Pitangus sulphuratus), called bem-te-vi in Brazil and benteveo in Argentina, is a passerine bird in the tyrant flycatcher family Tyrannidae",great kiskadee,"bem-te-vi, benteveo",Pitangus sulphuratus
280,The great knot (Calidris tenuirostris) is a small wader,great knot,,Calidris tenuirostris
281,"The great lizard cuckoo (Coccyzus merlini) is a species of bird in the tribe Phaenicophaeini, subfamily Cuculinae of the cuckoo family Cuculidae",great lizard cuckoo,,Coccyzus merlini
282,"The great myna (Acridotheres grandis), also known as the white-vented myna, is a species of starling in the family Sturnidae",myna,white-vented myna,Acridotheres grandis
283,"The Great Nicobar serpent eagle (Spilornis klossi), also known as the South Nicobar serpent eagle, is a species of bird of prey in the family Accipitridae",Great Nicobar serpent eagle,South Nicobar serpent eagle,Spilornis klossi
284,The great potoo (Nyctibius grandis) is the largest potoo species and is widely distributed in Central and South America,potoo,great potoo,Nyctibius grandis
285,The great rosefinch (Carpodacus rubicilla) is a species of finch in the family Fringillidae,Great Rosefinch,,Carpodacus rubicilla
286,"The great rufous woodcreeper (Xiphocolaptes major) is a species of bird in the Dendrocolaptinae subfamily, the woodcreepers",Great Rufous Woodcreeper,,Xiphocolaptes major
287,The great shearwater (Ardenna gravis) is a large shearwater in the seabird family Procellariidae,shearwater,,Ardenna gravis
288,"The great shortwing (Heinrichia calligyna) is a species of bird in the family Muscicapidae, and the only member of its genus",great shortwing,,Heinrichia calligyna
289,The great shrike-tyrant (Agriornis lividus) is a species of bird in the family Tyrannidae,shrike-tyrant,,Agriornis lividus
290,The great slaty woodpecker (Mulleripicus pulverulentus) is a species of bird in the family Picidae,Great Slaty Woodpecker,,Mulleripicus pulverulentus
291,"The great sparrow (Passer motitensis), also known as the southern rufous sparrow, is found in southern Africa in dry, wooded savannah and towns",great sparrow,Southern rufous sparrow,Passer motitensis
292,"The great spotted kiwi, great grey kiwi[2] or roroa (Apteryx haastii) is a species of kiwi endemic to the South Island of New Zealand",Kiwi,"Great spotted kiwi, Great grey kiwi",Apteryx haastii
293,The great spotted woodpecker (Dendrocopos major) is a medium-sized woodpecker with pied black and white plumage and a red patch on the lower belly,Great spotted woodpecker,,Dendrocopos major
294,"The great stone-curlew or  great thick-knee (Esacus recurvirostris) is a large wader which is a resident breeder in tropical southern Asia from India, Pakistan, Sri Lanka, Bangladesh into South-east Asia",Great Stone-Curlew,Great Thick-Knee,Esacus recurvirostris
295,The great swallow-tailed swift (Panyptila sanctihieronymi) is a species of bird in subfamily Apodinae of the swift family Apodidae,swallow-tailed swift,,Panyptila sanctihieronymi
296,The great thrush (Turdus fuscater) is a species of bird in the family Turdidae,Great Thrush,,Turdus fuscater
297,The great tit (Parus major) is a passerine bird in the tit family Paridae,great tit,,Parus major
298,"The great white pelican (Pelecanus onocrotalus) also known as the eastern white pelican, rosy pelican or white pelican is a bird in the pelican family",great white pelican,"Eastern white pelican, Rosy pelican, White pelican",Pelecanus onocrotalus
299,"The great woodswallow (Artamus maximus), also known as the greater woodswallow, giant woodswallow or New Guinea woodswallow is a species of bird in the family Artamidae",great woodswallow,"greater woodswallow, giant woodswallow, New Guinea woodswallow",Artamus maximus
300,"The great xenops (Megaxenops parnaguae) is a furnariid bird, which is endemic to the Caatinga region of north-eastern Brazil",xenops,,Megaxenops parnaguae
301,The great-billed hermit (Phaethornis malaris) is a species of hummingbird in the family Trochilidae,Great-billed Hermit,,Phaethornis malaris
